,sentence1,source1_np0,sentence2,source2_np0,label
0,What was an imported food that provided most of the carbohydrates ?,an imported food that provided most of the carbohydrates,Bananas arrived in the region and added an important source of carbohydrates to the diet ; they were also used in the production of alcoholic beverages . [ when ? ],an important source,0
1,What ' s the medical term for TB when it spreads from the lungs to other parts of the body ?,the medical term for TB,"In 15 – 20 % of active cases , the infection spreads outside the lungs , causing other kinds of TB .",the infection,1
2,Paraffin wax is an example of what kind of storage media ?,Paraffin wax,Phase change materials such as paraffin wax and Glauber ' s salt are another thermal storage media .,Phase change materials such as paraffin wax and Glauber ' s salt,0
3,In what century did Hyderabad style painting develop ?,Hyderabad style painting,The Hyderabad style originated in the 17 th century under the Nizams .,The Hyderabad style,0
4,Which religion is cited as having problems with modern biblical criticism ?,problems with modern biblical criticism,Issues in the Protestant churches have included modern biblical criticism and the nature of God .,Issues in the Protestant churches,0
5,Who took Urban ' s spot at the New York auditions ?,Urban ' s spot,Eighth season runner - up Adam Lambert filled in for Urban during the New York City auditions .,Eighth season runner,0
6,What is a notable architectural feature of the basilica ?,a notable architectural feature of the basilica,"Other new features of religious architecture include the crossing tower and a monumental entrance to the church , usually at the west end of the building .",Other new features of religious architecture,1
7,What does the tree live on ?,the tree,"and , in the past , by the American chestnut ( Castanea dentata ) .",the past,1
8,What condition was Napoleon ' s body in when it was moved in 1840 ?,Napoleon ' s body,"His description of Napoleon in the months before his death led Sten Forshufvud in a 1961 paper in Nature to put forward other causes for his death , including deliberate arsenic poisoning .",His description of Napoleon in the months before his death,1
9,What language can be found used in Kosovo and Albania ?,Kosovo and Albania,"Albanian is spoken in Albania , Kosovo , Macedoonia , and parts of Greece .","Albania , Kosovo , Macedoonia , and parts of Greece",0
10,Which states had the same stadtholder as Holland ?,the same stadtholder as Holland,"However , in practice the princes of Orange of the House of Orange - Nassau , beginning with William the Silent , were always chosen as stadtholders of most of the provinces .","the princes of Orange of the House of Orange - Nassau , beginning with William the Silent ,",1
11,"To what does "" channel "" refer in terms if adolescent communication ?",adolescent communication,"Channel , in this respect , refers to the form of communication , be it face - to - face , email , text message , phone or other .",this respect,0
12,The first transistorised computer was operational in what year ?,The first transistorised computer,"Their first transistorised computer and the first in the world , was operational by 1953 , and a second version was completed there in April 1955 .","Their first transistorised computer and the first in the world ,",0
13,What year did the Neuropsychopharmacology journal publist a study about the effect on the brain of beers flavor ?,the Neuropsychopharmacology journal,"A study published in the Neuropsychopharmacology journal in 2013 revealed the finding that the flavour of beer alone could provoke dopamine activity in the brain of the male participants , who wanted to drink more as a result .",A study published in the Neuropsychopharmacology journal in 2013,0
14,What did the NAS Bermuda offer once designated Annex ?,the NAS Bermuda offer,"It provided optional anchorage and / or dockage facilities for transiting US Navy , US Coast Guard and NATO vessels , depending on size .",optional anchorage and / or dockage facilities,0
15,What did Nasser want to use the agreement to do ?,the agreement,"Nasser had initially rejected the plan , but conceded under pressure from the Soviet Union , which feared that escalating regional conflict could drag it into a war with the US .",the plan,1
16,The early Queen logo resembled the coat of arms of what country ?,The early Queen logo,"The whole symbol bears a passing resemblance to the Royal coat of arms of the United Kingdom , particularly with the lion supporters .",The whole symbol,0
17,Ann Arbor has been linked with which university ?,Ann Arbor,"It was not until the early 1880 s that Ann Arbor again saw robust growth , with new immigrants coming from Greece , Italy , Russia , and Poland .",the early 1880 s,1
18,Many of John ' s mistresses were what ?,Many of John ' s mistresses,"It was common for kings and nobles of the period to keep mistresses , but chroniclers complained that John ' s mistresses were married noblewomen , which was considered unacceptable .",kings and nobles of the period,0
19,Which of Bell ' s students is the most well known ?,Bell ' s students,"She was later to say that Bell dedicated his life to the penetration of that "" inhuman silence which separates and estranges . """,his life,1
20,What Manhattan development is the product of land reclamation ?,Manhattan development,"The city ' s land has been altered substantially by human intervention , with considerable land reclamation along the waterfronts since Dutch colonial times ; reclamation is most prominent in Lower Manhattan , with developments such as Battery Park City in the 1970 s and 1980 s .",The city ' s land,0
21,What has increased tourism to Tibet in recent years ?,recent years,"In recent years , due to increased interest in Tibetan Buddhism , tourism has become an increasingly important sector , and is actively promoted by the authorities .",recent years,0
22,What sport does the most famous Namibian athlete participate in ?,the most famous Namibian athlete,"The most famous athlete from Namibia is Frankie Fredericks , sprinter ( 100 and 200 m ) .",The most famous athlete from Namibia,0
23,"Who was formally deposed by the Yugoslav Constitutent Assembly on November 29 , 1945 ?",the Yugoslav Constitutent Assembly,"On 29 November 1945 , King Peter II was formally deposed by the Yugoslav Constituent Assembly .",King Peter II,0
24,What year did Chopin compose his first work ?,his first work,"By the age of seven Fryderyk had begun giving public concerts , and in 1817 he composed two polonaises , in G minor and B - flat major .",the age of seven,0
25,What is used to close the circuit of a dipole antenna ?,the circuit of a dipole antenna,"In this way , the ground ( or any large conductive surface ) plays the role of the second conductor of a dipole , thereby forming a complete circuit .",the ground ( or any large conductive surface ),0
26,Who did Gegeen appoint as grand chancellor ?,grand chancellor,"They placed Yesün Temür ( or Taidingdi ) on the throne , and , after an unsuccessful attempt to calm the princes , he also succumbed to regicide .",Yesün Temür ( or Taidingdi ) on the throne,1
27,What did Musharraf say his ban wasn ' t influenced by ?,his ban wasn ' t,"It was not taken under any foreign influence "" .",any foreign influence,0
28,In what park is the American Airlines Arena located ?,the American Airlines Arena,"The largest and most popular parks are Bayfront Park and Bicentennial Park ( located in the heart of Downtown and the location of the American Airlines Arena and Bayside Marketplace ) , Tropical Park , Peacock Park , Morningside Park , Virginia Key , and Watson Island .",The largest and most popular parks,0
29,What was tyrothricin used for during the war ?,the war,Research results obtained during that period were not shared between the Axis and the Allied powers during the war .,Research results obtained during that period,1
30,How would you compare the rules of a treaty and a covenant under international law ?,the rules of a treaty and a covenant under international law,"Regardless of terminology , all of these forms of agreements are , under international law , equally considered treaties and the rules are the same .",all of these forms of agreements,0
31,What are these districts known as ?,these districts,"Districts are further divided into fifteen sub - districts known as nafot ( נפות ; singular : nafa ) , which are themselves partitioned into fifty natural regions .","fifteen sub - districts known as nafot ( נפות ; singular : nafa ) , which are themselves partitioned into fifty natural regions",1
32,What was the name of the non - subscription Xbox online gaming service ?,the name of the non - subscription Xbox online gaming service,"A Live Free account does not generally support multiplayer gaming ; however , some games that have rather limited online functions already , ( such as Viva Piñata ) or games that feature their own subscription service ( e . g . EA Sports games ) can be played with a Free account .",A Live Free account,1
33,Who wrote the supplemental material added to the Lectures book in 2005 ?,the supplemental material,"The Feynman Lectures on Physics is perhaps his most accessible work for anyone with an interest in physics , compiled from lectures to Caltech undergraduates in 1961 – 64 .",The Feynman Lectures on Physics,1
34,Who lead the rebellion against the 1211 settlement ?,the rebellion against the 1211 settlement,"John put off dealing with the badly deteriorating situation in North Wales , where Llywelyn the Great was leading a rebellion against the 1211 settlement .","the badly deteriorating situation in North Wales , where Llywelyn the Great was leading a rebellion against the 1211 settlement",0
35,The Melbourne financial crisis was a contributing factor to what banking crisis in 1893 ?,The Melbourne financial crisis,"A brash boosterism that had typified Melbourne during this time ended in the early 1890 s with a severe depression of the city ' s economy , sending the local finance and property industries into a period of chaos during which 16 small "" land banks "" and building societies collapsed , and 133 limited companies went into liquidation .",A brash boosterism that had typified Melbourne during this time,1
36,How is Houston Public Radio funded ?,Houston Public Radio,The Woodlands – Sugar Land metropolitan area is served by one public television station and two public radio stations .,The Woodlands – Sugar Land metropolitan area,1
37,What language is used for formal purposes by business and government institutes of New Delhi ?,formal purposes,English is primarily used as the formal language by business and government institutes .,the formal language,0
38,What is the liquefied mixture called ?,the liquefied mixture,"This mixture is often called "" bitumen feedstock "" , or BFS .",This mixture,0
39,what is the section of oklahoma and texas that Hernando de Soto traveled ?,the section of oklahoma and texas that Hernando de Soto traveled,"In that same time period , Hernando de Soto crossed a west - northwest direction in what is now Oklahoma and Texas .",Hernando de Soto,1
40,How are the terms Hispanic and Latino not specific ?,the terms Hispanic and Latino,"The definitions of both terms are non - race specific , and include people who consider themselves to be of distinct races ( Black , White , Amerindian , Asian , and mixed groups ) .",The definitions of both terms,0
41,What is the most prevalent type of climate nCalifornia ?,the most prevalent type of climate nCalifornia,"The Cascades are one of the snowiest places in the world , with some places averaging over 600 inches ( 1 , 524 cm ) of snow annually , but the lower elevations closer to the coast receive very little snow .",The Cascades,1
42,Although there are challenges a unified European alphabet is feasible even in the absence of which common language rule ?,challenges a unified European alphabet,"As briefly discussed in Unicode Technical Note # 26 , "" In terms of implementation issues , any attempt at a unification of Latin , Greek , and Cyrillic would wreak havoc [ and ] make casing operations an unholy mess , in effect making all casing operations context sensitive [ … ] "" .","any attempt at a unification of Latin , Greek , and Cyrillic",1
43,What is one type of pesticide ?,one type of pesticide,"Pesticides can also be considered as either biodegradable pesticides , which will be broken down by microbes and other living beings into harmless compounds , or persistent pesticides , which may take months or years before they are broken down : it was the persistence of DDT , for example , which led to its accumulation in the food chain and its killing of birds of prey at the top of the food chain .","the persistence of DDT , for example , which led to its accumulation in the food chain and its killing of birds of prey at the top of the food chain",0
44,Houston ranked 3 rd in which category by Forbes magazine in 2006 ?,which category,"Foreign governments have established 92 consular offices in Houston ' s metropolitan area , the third highest in the nation .",Foreign governments,1
45,What can be added to f0 to create a standing wave pattern ?,a standing wave pattern,"The standing wave forms with this desired pattern at the design frequency , f0 , and antennas are normally designed to be this size .",The standing wave,1
46,Why did India and Sweden never determine how much the US would compensate China ?,India and Sweden,The US proposed that a commission of India and Sweden determine what the US should pay in compensation but the Soviets vetoed the US proposal .,The US,0
47,What beach sport was inveted in San Diego ?,San Diego,"The amateur beach sport Over - the - line was invented in San Diego , and the annual world Over - the - line championships are held at Mission Bay every year .",The amateur beach sport Over - the - line,0
48,What do special referees have the ability to do ?,special referees,"They also have the power to eject from ringside any of the heel wrestler ' s entourage / stable , who may otherwise interfere with the match .","the power to eject from ringside any of the heel wrestler ' s entourage / stable , who may otherwise interfere with the match",0
49,"What airlines was award the "" Best regional airline in Europe "" award by Skytrax ?","the "" Best regional airline in Europe "" award","Readers Choice Awards : Top Domestic Airline "" award .",Readers Choice Awards,1
50,What things show Corks diverse culural background ?,Corks diverse culural background,"Cork also features various Christian churches , as well as a mosque .","various Christian churches , as well as a mosque",1
51,During what time did Kadamba rule northern Karnataka ?,northern Karnataka,"Kadamba ( 345 – 525 CE ) was an ancient royal dynasty of Karnataka , India that ruled northern Karnataka and the Konkan from Banavasi in present - day Uttara Kannada district .",Kadamba ( 345 – 525 CE ),0
52,Does a high ranking on the HDI indicate shorter or longer life expectancy ?,a high ranking on the HDI,"The Human Development Index ( HDI ) is a composite statistic of life expectancy , education , and income per capita indicators , which are used to rank countries into four tiers of human development .",The Human Development Index ( HDI ),1
53,How many prisoners did Napoleon ' s army capture in the Italian campaign ?,Napoleon ' s army capture,"In this Italian campaign , Bonaparte ' s army captured 150 , 000 prisoners , 540 cannons , and 170 standards .",Bonaparte ' s army,0
54,which bird migrates by circling the earth ?,the earth,"The Arctic tern holds the long - distance migration record for birds , travelling between Arctic breeding grounds and the Antarctic each year .",The Arctic tern,1
55,When did the Cincinnati Red Stockings come to be ?,the Cincinnati Red Stockings,"The franchise soon relocated to Boston and is now the Atlanta Braves , but its name survives as the origin for both the Cincinnati Reds and Boston Red Sox .",The franchise,1
56,Which street forms the boundary between Harlem and Washington Heights ?,the boundary between Harlem and Washington Heights,It is the northernmost of the 155 crosstown streets mapped out in the Commissioner ' s Plan of 1811 that established the numbered street grid in Manhattan .,the northernmost of the 155 crosstown streets mapped out in the Commissioner ' s Plan of 1811 that established the numbered street grid in Manhattan,1
57,What was the population of Sichuan in 1832 ?,the population of Sichuan,"As of 1832 , Sichuan was the most populous of the 18 provinces in China , with an estimated population at that time of 21 million .",the most populous,0
58,Who issued the first round of official characters ?,the first round of official characters,"Although most of the simplified Chinese characters in use today are the result of the works moderated by the government of the People ' s Republic of China in the 1950 s and 60 s , character simplification predates the republic ' s formation in 1949 .",character simplification,1
59,With what airline does Amtrak codeshare for transit to Newark Airport that originates or terminates at Union Station ?,transit to Newark Airport,"Amtrak also codeshares with United Airlines for travel to any airport serviced by United Airlines , via Newark Airport ( EWR ) originating from or terminating at Union Station ,",United Airlines,0
60,What did Samoa start growing more of to make up for the lost value of rubber ?,more of to make up for the lost value of rubber,"German merchants and settlers were active in introducing large scale plantation operations and developing new industries , notably cocoa bean and rubber , relying on imported labourers from China and Melanesia .",German merchants and settlers,1
61,"Besides Death Wish Coffee , how many other competitors participated in the contest ?",Death Wish Coffee,Death Wish Coffee beat out nine other contenders from across the United States for the free advertisement .,Death Wish Coffee,0
62,Where do unstressed vowels reduce to three ?,unstressed vowels,"There are a few instances of unreduced [ e ] , [ o ] in some words .","a few instances of unreduced [ e ] , [ o ] in some words",1
63,What did the March 2013 agreement decide ?,the March 2013 agreement,"The 2012 – 2013 Cypriot financial crisis led to an agreement with the Eurogroup in March 2013 to split the country ' s second largest bank , the Cyprus Popular Bank ( also known as Laiki Bank ) , into a "" bad "" bank which would be wound down over time and a "" good "" bank which would be absorbed by the Bank of Cyprus .",The 2012 – 2013 Cypriot financial crisis,0
64,What percentage of students were admitted to Notre Dame in fall 2015 ?,What percentage,"Notre Dame is known for its competitive admissions , with the incoming class enrolling in fall 2015 admitting 3 , 577 from a pool of 18 , 156 ( 19 . 7 % ) .",Notre Dame,0
65,The Palacio Taranco was erected to be the residence for whom ?,The Palacio Taranco,The palace is often used as a meeting place by the Uruguayan government .,The palace,1
66,Before the creation of the College of Engineering similar studies were carried out at which Notre Dame college ?,the creation of the College of Engineering similar studies,"The College of Engineering was established in 1920 , however , early courses in civil and mechanical engineering were a part of the College of Science since the 1870 s .",early courses in civil and mechanical engineering,0
67,What was determined to be the smallest effective round in 1935 ?,the smallest effective round,"However , in 1935 their trials showed that the minimum effective round was an impact fused 2 lb HE shell .",their trials,0
68,What year was the Canal de la Bruche added ?,the Canal de la Bruche,"That canal has since closed , but the subsequent Canal du Rhone au Rhine , Canal de la Marne au Rhin and Grand Canal d ' Alsace are still in use , as is the important activity of the Port autonome de Strasbourg .",That canal,1
69,Who was on Cygnet I when it crashed ?,Cygnet I,"The tetrahedral wings were named Cygnet I , II and III , and were flown both unmanned and manned ( Cygnet I crashed during a flight carrying Selfridge ) in the period from 1907 – 1912 .",The tetrahedral wings,0
70,Which type of schooling can be most expensive ?,Which type,"Open education is fast growing to become the dominant form of education , for many reasons such as its efficiency and results compared to traditional methods .",Open education,1
71,Is amnesia only seen in one form ?,one form,"Hyperthymesia , or hyperthymesic syndrome , is a disorder that affects an individual ' s autobiographical memory , essentially meaning that they can not forget small details that otherwise would not be stored .","Hyperthymesia , or hyperthymesic syndrome ,",1
72,What are pesticides most commonly used for ?,pesticides most commonly used for,"The most common use of pesticides is as plant protection products ( also known as crop protection products ) , which in general protect plants from damaging influences such as weeds , fungi , or insects .",The most common use of pesticides,0
73,In what year was Mubariz Khan defeated by Asif Jah I ?,Mubariz Khan,"In 1713 Farrukhsiyar , the Mughal emperor , appointed Asif Jah I to be Viceroy of the Deccan , with the title Nizam - ul - Mulk ( Administrator of the Realm ) .","Farrukhsiyar , the Mughal emperor ,",1
74,Which local author most recently enjoyed success for published works of fiction ?,published works of fiction,"In the 20 th century , numerous books were written and published locally , though few were directed at a wider market than Bermuda .",numerous books,1
75,What would the Chinese use to continue Confucian values ?,the Chinese,Their aim was to adopt western military technology in order to preserve Confucian values .,Their aim,0
76,Who did Victoria blame for the problems between herself and the Duchess ?,the problems between herself and the Duchess,"Through reading her mother ' s papers , Victoria discovered that her mother had loved her deeply ; she was heart - broken , and blamed Conroy and Lehzen for "" wickedly "" estranging her from her mother .",her mother ' s papers,0
77,What is another name for exoteric ?,another name for exoteric,"In the more spiritual or mystical Islamic tradition of Sufism , the position of spiritual teacher and an esoteric ( as opposed to exoteric , or actions - oriented , e . g . the Five Pillars of Islam ) spirituality and spiritual knowledge takes on a more important dimension , with emphasis on learning from living saints - the highest of which is a Qutb - and of traditions passed down from initiate to initiate , and traceable back to the founder of the order .",the position of spiritual teacher,0
78,What did the study aim to isolate ?,the study,"A detailed account of the techniques used to isolate the sounds deleted during MP3 compression , along with the conceptual motivation for the project , was published in the 2014 Proceedings of the International Computer Music Conference .","A detailed account of the techniques used to isolate the sounds deleted during MP3 compression , along with the conceptual motivation for the project ,",1
79,When did the sixth season of Digimon begin airing ?,the sixth season of Digimon,"It began airing in Japan on TV Asahi from July 6 , 2010 onwards .",TV Asahi,0
80,How many players can an NFL team have in the off - season ?,an NFL team,"These exhibition games , most of which are held in the month of August , are played for the purpose of helping coaches narrow down the roster from the offseason limit of 90 players to the regular - season limit of 53 players .","These exhibition games , most of which are held in the month of August ,",0
81,What ' s the name of the local ITV division ?,the name of the local ITV division,"That ' s Solent is an local television channel that began broadcasting in November 2014 , which will be based in and serve Southampton and Portsmouth .",That ' s Solent,1
82,What proves mosaics were used in the early middle ages ?,the early middle ages,"This could also be the case with the early 9 th century mosaic found under the Basilica of Saint - Quentin in Picardy , where antique motifs are copied but using only simple colors .",the case,1
83,What are three types of minerals Portugal is a notable producer of ?,three types,Portugal is a significant European minerals producer and is ranked among Europe ' s leading copper producers .,a significant European minerals producer,1
84,John spent much of 1205 doing what ?,much of 1205,John spent much of 1205 securing England against a potential French invasion .,much of 1205,0
85,During which financial year did the Melbourne rail network record its highest volume of passenger trips ?,which financial year,"In the 2013 – 2014 financial year , the Melbourne rail network recorded 232 . 0 million passenger trips , the highest in its history .",the Melbourne rail network,0
86,What town was Patrick Ollier a mayor of ?,Patrick Ollier,"Though the Metropole has a population of nearly seven million persons and accounts for 25 percent of the GDP of France , it has a very small budget ; just 65 million Euros , compared with eight billion Euros for the City of Paris .",a very small budget,1
87,Who translated the Bible to German ?,the Bible,"Lasting effects on the religions , cultures and languages of their respective countries have been exerted by such Bible translations as Martin Luther ' s into German , Jakub Wujek ' s into Polish , and the King James Bible ' s translators ' into English .","Lasting effects on the religions , cultures and languages of their respective countries",0
