,sentence1,source1_np0,sentence2,source2_np0,label
337,What are some examples of the science parks being built in Portugal ?,some examples of the science parks being built in Portugal,"With the emergence and growth of several science parks throughout the world that helped create many thousands of scientific , technological and knowledge - based businesses , Portugal started to develop several science parks across the country .","the emergence and growth of several science parks throughout the world that helped create many thousands of scientific , technological and knowledge - based businesses",1
338,What does the religious rites performed before battle suggest that the camp has become ?,the religious rites performed before battle,The perimeter procession and sacrifice suggest the entire camp as a divine templum ; all within are purified and protected .,The perimeter procession and sacrifice,0
339,A dog with countershading has dark coloring where ?,A dog with countershading,"A countershaded animal will have dark coloring on its upper surfaces and light coloring below , which reduces its general visibility .",A countershaded animal,0
340,Who were ' Ali ibn Abi Talib and ' Abdullah ibn ' Abbas ?,Ali ibn Abi Talib and ' Abdullah ibn ' Abbas,"According to the Quran , Muhammad was the first person who described the meanings of verses for early Muslims .",the first person who described the meanings of verses for early Muslims,1
341,The northern area of Great Britain was populated by what native people during the Roman Empire occupation ?,The northern area of Great Britain,"At that time , Ireland was populated by a people known as Hiberni , the northern third or so of Great Britain by a people known as Picts and the southern two thirds by Britons .",that time,0
342,Who was Jim Foster ' s employer prior to his founding the Arena Football League ?,Jim Foster ' s employer,"He presented the idea to a few friends at the NFL offices , where he received praise and encouragement for his concept .",the idea,1
343,What organization runs the largest line of ferries in the US ?,the largest line of ferries in the US,"Sound Transit currently provides an express bus service within the metropolitan area ; two Sounder commuter rail lines between the suburbs and downtown ; its Central Link light rail line , which opened in 2009 , between downtown and Sea - Tac Airport gives the city its first rapid transit line that has intermediate stops within the city limits .",two Sounder commuter rail lines between the suburbs and downtown,1
344,Who put out the torch along the route for protection ?,the torch,"These protests , which ranged from hundreds of people in San Francisco , to effectively none in Pyongyang , forced the path of the torch relay to be changed or shortened on a number of occasions .","These protests , which ranged from hundreds of people in San Francisco , to effectively none in Pyongyang ,",1
345,Name its northwestern coastal area .,its northwestern coastal area,The population is largely concentrated in two coastal areas : from Ferrol to A Coruña in the northwest and from Pontevedra to Vigo in the southwest .,The population,0
346,What is St . George credited with ?,St . George,It is the oldest continually inhabited English town in the New World .,the oldest continually inhabited English town in the New World,0
347,What was the earliest divergence within the Neognathes ?,the earliest divergence within the Neognathes,"The earliest divergence within the Neognathes was that of the Galloanserae , the superorder containing the Anseriformes ( ducks , geese , swans and screamers ) and the Galliformes ( the pheasants , grouse , and their allies , together with the mound builders and the guans and their allies ) .",The earliest divergence within the Neognathes,0
348,How many times did Elizabeth reject Albert ' s proposal ?,Albert ' s proposal,"In the words of Lady Elizabeth ' s mother , Albert would be "" made or marred "" by his choice of wife .",the words of Lady Elizabeth ' s mother,1
349,"What had been used to justify discrimination , apartheid , slavery and genocide in WWII ?","discrimination , apartheid , slavery and genocide in WWII","Alongside empirical and conceptual problems with "" race "" , following the Second World War , evolutionary and social scientists were acutely aware of how beliefs about race had been used to justify discrimination , apartheid , slavery , and genocide .","empirical and conceptual problems with "" race """,0
350,Strang is an Anglo - Saxon word which means what in modern English ?,an Anglo - Saxon word which means what in modern English,The Geordie dialect has much of its origins in the language spoken by the Anglo - Saxon populations who migrated to and conquered much of England after the end of Roman Imperial rule .,The Geordie dialect,1
351,What chemical treatment will prevent bare copper from oxidizing ?,bare copper,"The HASL finish prevents oxidation from the underlying copper , thereby guaranteeing a solderable surface .",The HASL finish,1
352,What is Florida ' s busiest airport ?,Florida ' s busiest airport,"Miami International Airport and PortMiami are among the nation ' s busiest ports of entry , especially for cargo from South America and the Caribbean .",Miami International Airport and PortMiami,0
353,What did the 1946 constitution establish Brazzaville as ?,the 1946 constitution,The Brazzaville Conference of 1944 heralded a period of major reform in French colonial policy .,The Brazzaville Conference of 1944,1
354,What did the expiation of a prodigy impose ?,the expiation of a prodigy,"The Senate decided whether a reported prodigy was false , or genuine and in the public interest , in which case it was referred to the public priests , augurs and haruspices for ritual expiation .",The Senate,1
355,Who was the host of American Idol in its fourteenth season ?,the host of American Idol,"Ryan Seacrest returned to host , while Jennifer Lopez , Keith Urban and Harry Connick , Jr . returned for their respective fourth , third and second seasons as judges .",Ryan Seacrest,0
356,"Who composed the song "" Karneval in Paris "" ?","the song "" Karneval in Paris ""","From 1863 , the artist federation kunstnerforeningen held annual Carnival balls in the old Freemasons lodge , which inspired Johan Svendsens compositions "" Norsk Kunstnerkarneval "" and "" Karneval in Paris "" .",the artist federation kunstnerforeningen,0
357,What ' s the title of Schwarzenegger ' s 1977 book ?,the title of Schwarzenegger ' s 1977 book,"After taking English classes at Santa Monica College in California , he earned a BA by correspondence from the University of Wisconsin – Superior , where he graduated with a degree in international marketing of fitness and business administration in 1979 .","correspondence from the University of Wisconsin – Superior , where he graduated with a degree in international marketing of fitness and business administration in 1979",1
358,When was the ACTA trade agreement signed ?,the ACTA trade agreement,"While copyright is created the instance a work is fixed , generally the copyright holder can only get money damages if the owner registers the copyright . [ citation needed ]",the copyright holder,1
359,"Who produced What ' s Opera , Doc ?",s Opera,Several works from the Golden Age of Animation matched the action to classical music .,Several works from the Golden Age of Animation,1
360,Where were the envoys sent ?,the envoys,"According to the Records of the Founding Emperor , the Hongwu Emperor issued an edict granting the title "" Initiation State Master "" to Sagya Gyaincain , while the latter sent envoys to the Ming court to hand over his jade seal of authority along with tribute of colored silk and satin , statues of the Buddha , Buddhist scriptures , and sarira .",the Hongwu Emperor,0
361,In what year did Christian troops lose control of Valencia ?,Christian troops,"The declining power of the Almoravids coincided with the rise of a new dynasty in North Africa , the Almohads , who seized control of the peninsula from the year 1145 , although their entry into Valencia was deterred by Ibn Mardanis , King of Valencia and Murcia until 1171 , at which time the city finally fell to the North Africans .",The declining power of the Almoravids,1
362,What do annelids without septa have to use for circulation ?,annelids without septa,Species with poorly developed or no septa generally have no blood vessels and rely on the circulation within the coelom for delivering nutrients and oxygen .,Species with poorly developed or no septa,0
363,In what year did Pope Paul VI close the Second Vatican Counsel ?,Pope Paul VI,"John XXIII elevated him to the College of Cardinals in 1958 , and after the death of John XXIII , Montini was considered one of his most likely successors .",John XXIII,1
364,What are there 10 million of each year at the airport ?,there 10 million,The airport authority tripled the size of its Terminal 2 ( formerly Terminal C ) in January 2011 .,The airport authority,1
365,What did Chopin create for Grand Duke Constantine ?,Grand Duke Constantine,"During this period , Fryderyk was sometimes invited to the Belweder Palace as playmate to the son of the ruler of Russian Poland , Grand Duke Constantine ; he played the piano for the Duke and composed a march for him .",this period,0
366,Who maintains a standard of grouping for naming purposes ?,a standard of grouping,These groupings have since been revised to align better with the Darwinian principle of common descent – grouping organisms by ancestry rather than superficial characteristics .,These groupings,1
367,How many newborns were born with issues due to Kevadon ?,issues due to Kevadon,"Over 20 , 000 Americans received thalidomide in this "" study , "" including 624 pregnant patients , and about 17 known newborns suffered the effects of the drug . [ citation needed ]","Over 20 , 000 Americans",0
368,To who did Kanye state that Beck should hand his award over to ?,Kanye state,"On February 8 , 2015 , at the 57 th Annual Grammy Awards , West walked on stage as Beck was accepting his award for Album of the Year and then walked off stage , making everyone think he was joking around .","February 8 , 2015",1
369,What did the sisters not have ?,the sisters,Their lives were often much more strict than their brothers ' lives .,Their lives,1
370,The beginning of what ended the Porfiriato ?,The beginning,The end of the Porfiriato came in 1910 with the beginning of the Mexican Revolution .,The end of the Porfiriato,0
371,Where did Eric Scott Raymond fly using a solar powered plane in 1990 ?,Eric Scott Raymond,"In 1974 , the unmanned AstroFlight Sunrise plane made the first solar flight .",the unmanned AstroFlight Sunrise plane,1
372,What was the Plos Pathogens paper about ?,the Plos Pathogens paper,"In October 2010 , the open - access scientific journal PLoS Pathogens published a paper by a multinational team who undertook a new investigation into the role of Yersinia pestis in the Black Death following the disputed identification by Drancourt and Raoult in 1998 .",the open - access scientific journal PLoS Pathogens,0
373,What organization invested half a million pounds in the SeaCity Museum ?,half a million pounds,"The city is home to the longest surviving stretch of medieval walls in England , as well as a number of museums such as Tudor House Museum , reopened on 30 July 2011 after undergoing extensive restoration and improvement ; Southampton Maritime Museum ; God ' s House Tower , an archaeology museum about the city ' s heritage and located in one of the tower walls ; the Medieval Merchant ' s House ; and Solent Sky , which focuses on aviation .",The city,1
374,What anti - Semitic fabrication did The Times endorse in 1920 ?,The Times,"In the leader entitled "" The Jewish Peril , a Disturbing Pamphlet : Call for Inquiry "" , Steed wrote about The Protocols of the Elders of Zion :","the leader entitled "" The Jewish Peril , a Disturbing Pamphlet : Call for Inquiry "" ,",1
375,abbé Jean Meslier lived from what year to what year ?,abbé Jean Meslier,"John "" Walking "" Stewart ( 1747 - 1822 ) , whose insistence in seeing matter as endowed with a moral dimension had a major impact on the philosophical poetry of William Wordsworth ( 1770 - 1850 ) .","John "" Walking "" Stewart ( 1747 - 1822 ) , whose insistence in seeing matter as endowed with a moral dimension",1
376,When was the monk community installed ?,the monk community,The first reports of the abbey are based on a late tradition claiming that a young fisherman called Aldrich on the River Thames saw a vision of Saint Peter near the site .,The first reports of the abbey,1
377,What is the study of living organisms known as ?,the study of living organisms known as,The study of their properties is known as organic chemistry and their study in the context of living organisms is known as biochemistry .,The study of their properties,0
378,"How was "" This is My Now "" decided as the first single for the American Idol winner in 2007 ?",the first single for the American Idol winner in 2007,"Thousands of recordings of original songs were submitted by songwriters , and 20 entries selected for the public vote .",Thousands of recordings of original songs,0
379,Feminist economists Ailsa McKay and Margunn Bjornhold believe that the financial crisis and response reveal a crisis of ideas in this ?,Feminist economists Ailsa McKay and Margunn Bjornhold,"Feminist economists Ailsa McKay and Margunn Bjørnholt argue that the financial crisis and the response to it revealed a crisis of ideas in mainstream economics and within the economics profession , and call for a reshaping of both the economy , economic theory and the economics profession .",Feminist economists Ailsa McKay and Margunn Bjørnholt,0
380,How many battles were conducted by Rome before they were forced to flee in The First Samnite War ?,The First Samnite War,"Rome beat the Latins in the Battle of Vesuvius and again in the Battle of Trifanum , after which the Latin cities were obliged to submit to Roman rule .",the Latins,1
381,In what publication did the name Rajasthan first appear ?,the name Rajasthan,"The first mention of the name "" Rajasthan "" appears in James Tod ' s 1829 publication Annals and Antiquities of Rajast ' han or the Central and Western Rajpoot States of India , while the earliest known record of "" Rajputana "" as a name for the region is in George Thomas ' s 1800 memoir Military Memories .","The first mention of the name "" Rajasthan """,0
382,What revolution made whites fearful of retribution of slaves ?,retribution of slaves,"Later , the state legislature passed laws requiring individual legislative approval for manumission ( the freeing of a slave ) and regulating activities of free blacks and slaves .",the state legislature,1
383,What instrument is usually at the center of a hard rock sound ?,the center of a hard rock sound,"Hard rock is a form of loud , aggressive rock music .",Hard rock,1
384,What is the primary use of Compact Disc + Graphics ?,the primary use of Compact Disc + Graphics,Compact Disc + Graphics is a special audio compact disc that contains graphics data in addition to the audio data on the disc .,Compact Disc + Graphics,1
385,Why is Isaac Hunter ' s Tavern popular ?,Isaac Hunter ' s,"The city ' s location was chosen , in part , for being within 11 mi ( 18 km ) of Isaac Hunter ' s Tavern , a popular tavern frequented by the state legislators .",The city ' s location,0
386,Why have wall mosaics generally not survived in the region ?,wall mosaics,The mosaic was probably created in 565 / 6 .,The mosaic,1
387,Which two vernaculars hold relation to the official language ?,relation to the official language,"It is also used to write Pali , the sacred language of Theravada Buddhism , as well as several ethnic minority languages , including Shan , several Karen dialects , and Kayah ( Karenni ) , with the addition of specialised characters and diacritics for each language .","Pali , the sacred language of Theravada Buddhism ,",1
388,On which street is the Jacob K . Javits Convention Center located ?,the Jacob K . Javits Convention Center,"Notable locations include East River Ferry , LaptopMD headquarters , Mercy College Manhattan Campus , and Jacob K . Javits Convention Center .",Notable locations,1
389,What were the two scales defined as ?,the two scales,"Berlin sexologist Magnus Hirschfeld published a scheme in 1896 that measured the strength of an individual ' s sexual desire on two independent 10 - point scales , A ( homosexual ) and B ( heterosexual ) .",Berlin sexologist Magnus Hirschfeld,0
390,From what time period are the oldest artifacts in Kathmandu museums ?,the oldest artifacts in Kathmandu museums,"The museums display unique artifacts and paintings from the 5 th century CE to the present day , including archeological exportation .",The museums,0
391,What farmers use integrated pest management strategies ?,integrated pest management strategies,"On monoculture farms , the approach is generally to eradicate associated diversity using a suite of biologically destructive pesticides , mechanized tools and transgenic engineering techniques , then to rotate crops .",the approach,1
392,Where did the Dalai Lama ' s government flee to during the 1959 Tibetan Rebellion ?,the Dalai Lama ' s government,In 1962 China and India fought a brief war over the disputed South Tibet and Aksai Chin regions .,China and India,1
393,"When was Vieira , a former president , deposed ?","Vieira , a former president ,","In June 2005 , presidential elections were held for the first time since the coup that deposed Ialá .",presidential elections,1
394,What is the name of the regiment that frequently served as Napoleon ' s escort ?,the name of the regiment that frequently served as Napoleon ' s escort,"When he became First Consul and later Emperor , Napoleon eschewed his general ' s uniform and habitually wore the simple green colonel uniform ( non - Hussar ) of a colonel of the Chasseur à Cheval of the Imperial Guard , the regiment that often served as his personal escort , with a large bicorne .",his general ' s uniform,0
395,What does extra twisting of lisle thread produce ?,extra twisting of lisle thread,Lisle is composed of two strands that have each been twisted an extra twist per inch than ordinary yarns and combined to create a single thread .,two strands that have each been twisted an extra twist per inch than ordinary yarns and combined to create a single thread,0
396,What marked the beginning of the Roman Republic ?,the beginning of the Roman Republic,"However , most use the same date as did the ancient Romans themselves , the Roman Senate ' s grant of extraordinary powers to Octavian and his adopting the title Augustus in 27 BC , as the defining event ending the Republic .",the same date,1
397,How long did it actually take to complete Principia Mathematica ?,Principia Mathematica,"Despite the initial loss , today there is likely no major academic library in the world which does not hold a copy of Principia Mathematica .",the initial loss,1
398,Who killed François Darlan ?,François Darlan,"Eisenhower later appointed General Henri Giraud as High Commissioner , who had been installed by the Allies as Darlan ' s commander - in - chief , and who had refused to postpone the execution .",General Henri Giraud,1
399,What river flows into the River Thames ?,the River Thames,"This bridge either crossed the Thames , or went to a now lost island in the river .",This bridge,1
400,What magazine called Schwarzenegger America ' s most famous immigrant ?,America ' s,Immigration law firm Siskind & Susser have stated that Schwarzenegger may have been an illegal immigrant at some point in the late 1960 s or early 1970 s because of violations in the terms of his visa .,Immigration law firm Siskind & Susser,1
401,What is the syrinx ?,the syrinx,"Sound production is achieved using the syrinx , a muscular chamber incorporating multiple tympanic membranes which diverges from the lower end of the trachea ; the trachea being elongated in some species , increasing the volume of vocalizations and the perception of the bird ' s size .",Sound production,0
402,What is the modern study of genetics at the level of DNA known as ?,the modern study,The modern study of genetics at the level of DNA is known as molecular genetics .,The modern study of genetics at the level of DNA,0
403,How many overseas territories remain under British sovereignty ?,British sovereignty,"Although the British Empire achieved its largest territorial extent immediately after World War I , Britain was no longer the world ' s pre - eminent industrial or military power .",the world ' s pre - eminent industrial or military power,1
404,Where were items from the clothing line displayed ?,items from the clothing line,"The collection features sportswear , denim offerings with fur , outerwear and accessories that include handbags and footwear , and are available at department and specialty stores across the US and Canada .",The collection,1
405,Where can you find carpets and objects from the orient ?,carpets and objects from the orient,Carpets and objects from the orient can be visited in the Oriental Carpet Museum .,Carpets and objects from the orient,0
406,When was Alexander Balus composed ?,Alexander Balus,Antonio Maria Bononcini composed La conquista delle Spagne di Scipione Africano il giovane in 1707 and George Frideric Handel composed Alexander Balus in 1748 .,Antonio Maria Bononcini,0
407,How many nations receive the Idol broadcast ?,the Idol broadcast,In most nations these are not live broadcasts and may be tape delayed by several days or weeks .,most nations,1
408,What is the best know musical genre amongst the Tigrinya ?,the best know musical genre amongst the Tigrinya,"The most popular Eritrean artist is the Tigrinya singer Helen Meles , who is noted for her powerful voice and wide singing range .",The most popular Eritrean artist,1
409,Who came up with an explanation of the origins of London ' s name that contradicted earlier assumptions,an explanation of the origins of London ' s name that contradicted earlier assumptions,"From 1898 , it was commonly accepted that the name was of Celtic origin and meant place belonging to a man called * Londinos ; this explanation has since been rejected .",this explanation,1
410,Which team was denied entry into the Champions League in 2012 due to being bumped out of the running by the defending champion ?,entry into the Champions League,"However , for those leagues with four entrants in the Champions League , this meant that if the Champions League winner finished outside the top four in its domestic league , it would qualify at the expense of the fourth - placed team in the league .",those leagues with four entrants in the Champions League,1
411,"What does NATO define as passive measures to protect people , buildings and equipment from air or missile attacks ?","passive measures to protect people , buildings and equipment from air or missile attacks","Passive air defence is defined by NATO as "" Passive measures taken for the physical defence and protection of personnel , essential installations and equipment in order to minimize the effectiveness of air and / or missile attack "" .",Passive air defence,0
412,What year did Simon Cowell announce that he was leaving American Idol ?,Simon Cowell,"On January 11 , 2010 , Simon Cowell announced that he was leaving the show to pursue introducing the American version of his show The X Factor to the USA for 2011 .",Simon Cowell,0
413,What are potential sources of cellulosic biomass ?,potential sources of cellulosic biomass,"Crop residues ( such as corn stalks , wheat straw and rice straw ) , wood waste , and municipal solid waste are potential sources of cellulosic biomass .","Crop residues ( such as corn stalks , wheat straw and rice straw ) , wood waste , and municipal solid waste",0
414,When was the Armenian Mosaic re - discovered ?,the Armenian Mosaic,"The most important is the so - called "" Armenian Mosaic "" which was discovered in 1894 on the Street of the Prophets near Damascus Gate .",The most important,0
415,A party ' s consent to a treaty is invalid if it had been given by an agent or body without power to do so under what ?,A party ' s consent to a treaty,"States are reluctant to inquire into the internal affairs and processes of other states , and so a "" manifest violation "" is required such that it would be "" objectively evident to any State dealing with the matter "" .","a "" manifest violation """,1
416,Who was the president of alternative programming at Fox ?,the president of alternative programming at Fox,Much early attention on the show was therefore focused on the widowhood of Danny Gokey . [ citation needed ],Much early attention on the show,1
417,What was the first type of government that Libya had ?,the first type of government that Libya had,"In 1951 , the UN created the United Kingdom of Libya , a federal state under the leadership of a pro - western monarch , Idris , who banned political parties and established an absolute monarchy .",the UN,0
418,What is the name of the campus radio station ?,the name of the campus radio station,"While students used to broadcast on AM & FM frequencies , they now have an Internet - only stream .",an Internet - only stream,1
419,How many pandas escaped the reserve ?,the reserve,Six pandas escaped after their enclosures were damaged .,Six pandas,0
420,What is the materialistic view of matter in relation to other objects ?,the materialistic view of matter in relation to other objects,It sees every object as distinct and discrete from all other objects .,every object,0
