,sentence1,source1_np0,sentence2,source2_np0,label
88,Classical music is rooted in what kind of tradition ?,Classical music,"The central norms of this tradition became codified between 1550 and 1900 , which is known as the common practice period .",The central norms of this tradition,1
89,What did the Pan American Health organization say these treatments violated ?,the Pan American Health organization,"Additionally , the Pan American Health Organization recommended that such malpractices be denounced and subject to sanctions and penalties under national legislation , as they constitute a violation of the ethical principles of health care and violate human rights that are protected by international and regional agreements .",the Pan American Health Organization,0
90,How does the US Air Force differ from other branches of the military ?,the US Air Force,"Although the paradigm is changing , for most of its history , the Air Force , completely unlike its sister services , has been an organization in which mostly its officers fought , not its enlisted force , the latter being primarily a rear echelon support force .",the Air Force,0
91,During what years did the Serbian Revolution occur ?,the Serbian Revolution,"A rebellion that originated in Moldavia as a diversion was followed by the main revolution in the Peloponnese , which , along with the northern part of the Gulf of Corinth , became the first parts of the Ottoman Empire to achieve independence ( in 1829 ) .",A rebellion that originated in Moldavia as a diversion,1
92,What is one way that the Empire was described as it related to culture ?,one way that the Empire was described as it related to culture,"When compared to the Turkish folk culture , the influence of these new cultures in creating the culture of the Ottoman elite was clear .",the influence of these new cultures in creating the culture of the Ottoman elite,1
93,What is the goal of Smart Bodies ?,the goal of Smart Bodies,It is an interactive educational program designed to help prevent childhood obesity through classroom activities that teach children healthful eating habits and physical exercise .,an interactive educational program designed to help prevent childhood obesity through classroom activities that teach children healthful eating habits and physical exercise,1
94,What are the Bronx ' s four low peninsulas ?,the Bronx ' s four low peninsulas,"Further up the coastline , Rodman ' s Neck lies between Pelham Bay Park in the northeast and City Island .",Rodman ' s Neck,1
95,On which date did Arsenal name a fully foreign 16 - man squad for a match ?,which date,"On 26 December 1999 , Chelsea became the first Premier League side to field an entirely foreign starting line - up , and on 14 February 2005",26 December 1999,0
96,What follows the watershed from the Mediterranean Sea to the Wienerwald ?,the watershed,"Upon reaching the Swiss border , the line of the main chain heads approximately east - northeast , a heading it follows until its end near Vienna .",the line,1
97,In what city did the 1981 FIBA African Championship take place ?,the 1981 FIBA African Championship,"He also won silver medals in this event at the 1987 and 1991 World Championships , as well as the 1985 IAAF World Marathon Cup .",silver medals,1
98,Where in the United States did the Spanish explore ?,the Spanish,The Spanish explorers explored areas of 42 future U . S . states leaving behind a varying range of Hispanic legacy in the North American continent .,The Spanish explorers,0
99,What is the process of adapting to the environment and inheriting changes through use or disuse called ?,the process of adapting to the environment and inheriting changes through use or disuse called,"Both envisaged that spontaneous generation produced simple forms of life that progressively developed greater complexity , adapting to the environment by inheriting changes in adults caused by use or disuse .",spontaneous generation,1
100,What American naval officer led a raid that destroyed a captured American ship ?,American naval officer,"After the U . S . S . Philadelphia was captured in 1803 , Lieutenant Stephen Decatur led a raid which successfully burned the captured ship , preventing Tripoli from using or selling it .",Lieutenant Stephen Decatur,0
101,In 2007 which Japenese Prime Minister said there was no proof of coercion of women to be sexual slaves ?,Japenese Prime Minister,"A widely publicised example of institutionalised sexual slavery are "" comfort women "" , a euphemism for the 200 , 000 women , mostly from Korea and China , who served in the Japanese army ' s camps during World War II .",A widely publicised example of institutionalised sexual slavery,1
102,Which European government contributed the least to the UNFPA in 2008 ?,the least to the UNFPA,"Of the total income of M845 . 3 M , $ 118 was donated by the Netherlands , $ 67 M by Sweden , $ 62 M by Norway , $ 54 M by Denmark , $ 53 M by the UK , $ 52 M by Spain , $ 19 M by Luxembourg .",$ 67 M by Sweden,0
103,In what geographic part of Libya is Bani Walid located ?,Bani Walid,"Only a few towns in western Libya — such as Bani Walid , Sebha and Sirte — remained Gaddafist strongholds .",Only a few towns,0
104,How many MRAP vehicles has the Pentagon bought since 2007 ?,the Pentagon,"The Oshkosh M - ATV will be kept the most at 5 , 681 vehicles , as it is smaller and lighter than other MRAPs for off - road mobility .",The Oshkosh M - ATV,1
105,Why does Stewart Guthrie believe that people project their human features onto non human things ?,Stewart Guthrie,"Pascal Boyer argues that while there is a wide array of supernatural concepts found around the world , in general , supernatural beings tend to behave much like people .",Pascal Boyer,1
106,Who is the interior moulding of the Mace and Chain building rumored to have belonged to ?,the interior moulding of the Mace and Chain building rumored to have belonged to,"Interior moulding is said to have belonged to Benedict Arnold ; Manuscript Society , King Lui - Wu with Dan Kniley responsible for landscaping and Josef Albers for the brickwork intaglio mural .",Interior moulding,0
107,Which former Idol star made an appearance for Cowell ' s tribute ?,an appearance for Cowell ' s tribute,A special tribute to Simon Cowell was presented in the finale for his final season with the show .,A special tribute to Simon Cowell,1
108,What is supposed to be the last resort for police ?,the last resort for police,"A "" shoot - to - kill "" policy was recently introduced in South Africa , which allows police to use deadly force against any person who poses a significant threat to them or civilians .","A "" shoot - to - kill "" policy",1
109,What Charleston Reverend established the Jenkins Orphanage ?,Charleston Reverend,The Jenkins Orphanage was established in 1891 by the Rev . Daniel J . Jenkins in Charleston .,The Jenkins Orphanage,0
110,Who helped Albert Magnus bring Aristotelian curriculum to Dominican classrooms ?,Albert Magnus,"Under the auspices of Humbert of Romans , Albert molded the curriculum of studies for all Dominican students , introduced Aristotle to the classroom and probed the work of Neoplatonists , such as Plotinus .",the auspices of Humbert of Romans,1
111,In what year was India ' s constitution drafted ?,India ' s constitution,"In India , the longest constitutional text in the history of the world has governed that country since 1950 .",the longest constitutional text in the history of the world,0
112,The highest ranking person ' s title in British india is ?,The highest ranking person ' s title in British india,The company was allowed to maintain its virtual monopoly over trade in exchange for the biennial sum and was obligated to export a minimum quantity of goods yearly to Britain .,The company,1
113,What was the policy of dividing land among families of color referred to as ?,the policy,"The decisions came to be known as affirmative action in which mandatory , as well as voluntary programs , affirmed the civil rights of people of color .",The decisions,1
114,When was Madonna ' s daughter born ?,Madonna ' s daughter,"Biographer Mary Cross writes that although Madonna was often ill during the filming and worried that her pregnancy would harm the film , she reached some important personal goals : "" Now 38 years old , Madonna had at last triumphed on screen and achieved her dream of having a child , both in the same year .",Biographer Mary Cross,1
115,Which family member came to Paris in June 1849 ?,Which family member,"In June 1849 his sister Ludwika came to Paris with her husband and daughter , and in September , supported by a loan from Jane Stirling , he took an apartment at Place Vendôme 12 .",his sister Ludwika,0
116,What is the Drosophila gene the cause of ?,the Drosophila gene,Their interactions result in an interlocked feedback loop of gene products resulting in periodic fluctuations that the cells of the body interpret as a specific time of the day . [ citation needed ],Their interactions,1
117,What national part is located in the South West ?,the South West,"In the north , the Manovo - Gounda St Floris National Park is well - populated with wildlife , including leopards , lions , cheetahs and rhinos , and the Bamingui - Bangoran National Park is located in the northeast of CAR .",the Manovo - Gounda St Floris National Park,1
118,How long was Nanjing the capital of the Southern dynasties ?,the capital of the Southern dynasties,"During the period of North – South division , Nanjing remained the capital of the Southern dynasties for more than two and a half centuries .",the period of North – South division,0
119,Southern Alaska has what two Koppen climate classifications ?,Southern Alaska,The climate in Southeast Alaska is a mid - latitude oceanic climate ( Köppen climate classification : Cfb ) in the southern sections and a subarctic oceanic climate ( Köppen Cfc ) in the northern parts .,The climate in Southeast Alaska,0
120,What did the movements in Bengal serve to awaken in Indians ?,the movements in Bengal,It played an important role in reawakening Indian minds and intellect across the sub - continent .,an important role,0
121,How high is Tucson ' s airport ?,Tucson ' s airport,"The highest point in the area is Mount Wrightson , found in the Santa Rita Mountains at 9 , 453 ft ( 2 , 881 m ) above sea level .",The highest point in the area,1
122,What is one agency who is trying to help make the trade of pesticides safer ?,one agency who is trying to help make the trade of pesticides safer,Three other efforts to improve regulation of international pesticide trade are the United Nations London Guidelines for the Exchange of Information on Chemicals in International Trade and the United Nations Codex Alimentarius Commission . [ citation needed ],Three other efforts to improve regulation of international pesticide trade,0
123,Which German politician defended comprehensive schools ?,Which German politician,"As a reaction , Sigrid Beer ( Alliance ' 90 / The Greens ) stated that comprehensives were structurally discriminated against by the government , which favoured the Gymnasiums .",Sigrid Beer ( Alliance ' 90 / The Greens ),0
124,What is Oklahoma ' s largest school district ?,Oklahoma ' s largest school district,"KIPP Reach College Preparatory School in Oklahoma City received the 2012 National Blue Ribbon along with its school leader , Tracy McDaniel Sr . , being awarded the Terrel H . Bell Award for Outstanding Leadership .",KIPP Reach College Preparatory School in Oklahoma City,1
125,What is the average income for a full time male worker ?,the average income for a full time male worker,"Full - time year - round male workers had a median income of $ 52 , 544 versus $ 46 , 540 for full - time year - round female workers .",Full - time year - round male workers,0
126,Who is a projecting Lady Chapel dedicated to ?,a projecting Lady Chapel,"It is often square ended or has a projecting Lady Chapel , dedicated to the Virgin Mary .","a projecting Lady Chapel , dedicated to the Virgin Mary",0
127,Is this licence required on a permanent basis ?,this licence,The UEFA Pro Licence is required by every person who wishes to manage a club in the Premier League on a permanent basis (,The UEFA Pro Licence,0
128,On what day did the 1975 constitutional crisis deadlock end ?,the 1975 constitutional crisis deadlock,"Following the 1974 – 75 Loans Affair , the Malcolm Fraser led Liberal - Country Party Coalition argued that the Whitlam Government was incompetent and delayed passage of the Government ' s money bills in the Senate , until the government would promise a new election .",the Malcolm Fraser,1
129,What type of covers of pop and rock songs were usually played on adult contemporary ?,covers of pop and rock songs,"The custom recordings were usually instrumental versions of current or recent rock and roll or pop hit songs , a move intended to give the stations more mass appeal without selling out .",The custom recordings,0
130,New forms of Buddhism are created because of what reason ?,New forms of Buddhism,"At the present time , the teachings of all three branches of Buddhism have spread throughout the world , and Buddhist texts are increasingly translated into local languages .",the teachings of all three branches of Buddhism,1
131,Goldenson proposed a merger between UPT and what network in October 1954 ?,a merger between UPT and what network in October 1954,"Despite the promise of non - interference between ABC and UPT , Goldenson had to intervene in ABC ' s decisions because of financial problems and the FCC ' s long period of indecision .",the promise of non - interference between ABC and UPT,1
132,What has been found along the current Route des Romains ?,the current Route des Romains,"Many Roman artifacts have also been found along the current Route des Romains , the road that led to Argentoratum , in the suburb of Kœnigshoffen .",Many Roman artifacts,0
133,Of what series in the Periodic Table of Elements is uranium a part ?,the Periodic Table of Elements,"Uranium has the second highest atomic weight of the primordially occurring elements , lighter only than plutonium .","the second highest atomic weight of the primordially occurring elements , lighter only than plutonium",1
134,It was an early backer of what,an early backer of what,"A key aspect of the Gates Foundation ' s U . S . efforts involves an overhaul of the country ' s education policies at both the K - 12 and college levels , including support for teacher evaluations and charter schools and opposition to seniority - based layoffs and other aspects of the education system that are typically backed by teachers ' unions .",A key aspect of the Gates Foundation ' s U . S . efforts,1
135,What number was the Tironian note visually similar to ?,the Tironian note,"The remaining 20 Latin letters were supplemented by four more : ⟨ æ ⟩ ( æsc , modern ash ) and ⟨ ð ⟩ ( ðæt , now called eth or edh ) , which were modified Latin letters , and thorn ⟨ þ ⟩ and wynn ⟨ ƿ ⟩ , which are borrowings from the futhorc .",The remaining 20 Latin letters,0
136,In which country did Madonna rubbed the country ' s flag between her thighs that anger the public ?,the country ' s flag,"In March 1994 , she appeared as a guest on the Late Show with David Letterman , using profanity that required censorship on television , and handing Letterman a pair of her panties and asking him to smell it .",a guest on the Late Show with David Letterman,1
137,What pay grades are included in the USAF for Senior NCOs ?,the USAF,"Above the pay grade of E - 4 ( i . e . , pay grades E - 5 through E - 9 ) all ranks fall into the category of NCO and are further subdivided into "" NCOs "" ( pay grades E - 5 and E - 6 ) and "" Senior NCOs "" ( pay grades E - 7 through E - 9 ) ; the term "" Junior NCO "" is sometimes used to refer to staff sergeants and technical sergeants ( pay grades E - 5 and E - 6 ) .","the term "" Junior NCO """,0
138,What percentage of Greece ' s economy is based on service ?,What percentage,"The Greek Merchant Navy is the largest in the world , with Greek - owned vessels accounting for 15 % of global deadweight tonnage as of 2013 .",The Greek Merchant Navy,1
139,When was Claridge ' s asphalt the most often used ?,Claridge ' s asphalt,"In 1838 , there was a flurry of entrepreneurial activity involving asphalt / bitumen , which had uses beyond paving .","a flurry of entrepreneurial activity involving asphalt / bitumen , which had uses beyond paving",1
140,Where was the lowest amount of U . S . dollars lost ?,the lowest amount of U . S . dollars lost,"The 2007 report showed that the Asia - Pacific region was associated with the highest amount of loss , in terms of U . S . dollars , with $ 14 , 090 , 000 , followed by the European Union , with a loss of $ 12 , 383 , 000 ; the lowest amount of U . S . dollars was lost in the Middle East / Africa region , where $ 2 , 446 , 000 was documented .",The 2007 report,0
141,Which two important psychologists did Popper view as advancing non - scientific theories ?,Popper view,He thus came to the conclusion that psychoanalytic theories had more in common with primitive myths than with genuine science .,the conclusion that psychoanalytic theories had more in common with primitive myths than with genuine science,1
142,What was the main problem with applying early electric motors to industry ?,the main problem with applying early electric motors to industry,"Due to the high cost of primary battery power , the motors were commercially unsuccessful and Davenport went bankrupt .",the high cost of primary battery power,0
143,What two cities in Turkey acquired institutes of technology in the 1950 s ?,institutes of technology,"In 1950 s , 2 technical universities were opened in Ankara and Trabzon .",2 technical universities,0
144,"Other than Gaj ' s Latin alphabet , what other written language can Serbo - Croatian be written in ?",Serbo - Croatian,"Like other South Slavic languages , Serbo - Croatian has a simple phonology , with the common five - vowel system and twenty - five consonants .",other South Slavic languages,1
145,What is the name of a Japanese wrestling company ?,the name of a Japanese wrestling company,"Other prominent professional wrestling companies worldwide include the US - based Total Nonstop Action Wrestling ( TNA ) and Ring of Honor ( ROH ) , Consejo Mundial de Lucha Libre ( CMLL ) and Asistencia Asesoría y Administración ( AAA ) in Mexico , and the Japanese New Japan Pro Wrestling ( NJPW ) , All Japan Pro Wrestling ( AJPW ) , and Pro Wrestling",Other prominent professional wrestling companies,0
146,In what year did Time magazine choose Seattle Central Community College as community college of the year ?,Time magazine,"In 2001 , Time magazine selected Seattle Central Community College as community college of the year , stating the school "" pushes diverse students to work together in small teams "" .",Time magazine,0
147,Anti - aircraft defenses became better after what ?,aircraft defenses,"It was to be some months before an effective night fighter force would be ready , and anti - aircraft defences only became adequate after the Blitz was over , so ruses were created to lure German bombers away from their targets .",some months,0
148,What company did Kanye West begin ?,Kanye West,"His more publicized comments include his declaration that President George W . Bush "" doesn ' t care about black people "" during a live 2005 television broadcast for Hurricane Katrina relief , and his interruption of singer Taylor Swift at the 2009 MTV Video Music Awards .",His more publicized comments,1
149,What is considered a key part of interior design ?,a key part of interior design,Lighting can also be an intrinsic component of landscape projects .,an intrinsic component of landscape projects,1
150,Name one of the poetic authors who was also nominated for the Nobel Peace Award from the Greeks ?,one of the poetic authors who was also nominated for the Nobel Peace Award from the Greeks,Alexandrian Constantine P . Cavafy and Nobel laureates Giorgos Seferis and Odysseas Elytis are among the most important poets of the 20 th century .,Alexandrian Constantine P . Cavafy and Nobel laureates Giorgos Seferis and Odysseas Elytis,0
151,What percent of the bus systems use alternate fuels ?,What percent,"The city first proposed its Sustainable City Plan in 1992 and in 1994 , was one of the first cities in the nation to formally adopt a comprehensive sustainability plan , setting waste reduction and water conservation policies for both public and private sector through its Office of Sustainability and the Environment .",The city,1
152,What are two things Chopin ' s performances were known for ?,two things,His keyboard style is highly individual and often technically demanding ; his own performances were noted for their nuance and sensitivity .,His keyboard style,0
153,"How many times is the word "" Quran "" used in the Quran ?","the word "" Quran ""","The word "" Quran "" occurs some 70 times in the text of the Quran , although different names and words are also said to be references to the Quran .","The word "" Quran """,0
154,On what service could the ESPN Deportes broadcast be streamed ?,the ESPN Deportes broadcast,The ESPN Deportes Spanish broadcast was made available through WatchESPN .,The ESPN Deportes Spanish broadcast,0
155,In which event did the rainforests collapsed in the carboniferous ?,the rainforests,"The worst was the Permian - Triassic extinction event , 251 million years ago .",The worst,0
156,How many nations do the twenty - five foreign banks represent ?,the twenty - five foreign banks,Forty foreign governments maintain trade and commercial offices here and 23 active foreign chambers of commerce and trade associations .,Forty foreign governments,1
157,What type of musicians besides classical have experimented with electronic instruments ?,musicians besides classical,"Electric instruments such as the electric guitar , the electric bass and the ondes Martenot appear occasionally in the classical music of the 20 th and 21 st centuries .","Electric instruments such as the electric guitar , the electric bass and the ondes Martenot",1
158,In what century was the church established at the location ?,the church,"Construction of the present church began in 1245 , on the orders of King Henry III .",Construction of the present church,1
159,What are three of the other health conditions that occur more frequently with asthma ?,three of the other health conditions that occur more frequently with asthma,"Those with asthma , especially if it is poorly controlled , are at high risk for radiocontrast reactions .",Those with asthma,1
160,How many times did Israelites have political independence in ancient history ?,political independence,"Since the destruction of the Second Temple in 70 CE , most Jews have lived in diaspora .",most Jews,1
161,"What does Canada being referred to as the 51 st state in a positive way mean in the US , generally ?",the 51 st state,"In the United States , the term "" the 51 st state "" when applied to Canada can serve to highlight the similarities and close relationship between the United States and Canada .","the term "" the 51 st state "" when applied to Canada",0
162,What type of penalty was made for unlawful performances that are willful and for profit ?,unlawful performances that are willful and for profit,"The first criminal provision in U . S . copyright law was added in 1897 , which established a misdemeanor penalty for "" unlawful performances and representations of copyrighted dramatic and musical compositions "" if the violation had been "" willful and for profit .",The first criminal provision in U . S . copyright law,0
163,"If the Prime Minister of the United Kingdom becomes sick in New York City , what hospital does he go to ?",the Prime Minister of the United Kingdom,Bellevue is the designated hospital for treatment of the President of the United States and other world leaders if they become sick or injured while in New York City .,the designated hospital for treatment of the President of the United States and other world leaders,1
164,what sound emerged in Detroit with the recordings of juan atkins and derrick may ?,the recordings of juan atkins and derrick may,"In Detroit a proto - techno music sound began to emerge with the recordings of Juan Atkins , Derrick May and Kevin Saunderson .",techno music sound,0
165,What year marked the onset of the Crusades ?,the onset of the Crusades,"Over this period of several hundred years , some have suggested , Jewish economic activity was focused on trade , business management , and financial services , due to several presumed factors : Christian European prohibitions restricting certain activities by Jews , preventing certain financial activities ( such as "" usurious "" loans ) between Christians , high rates of literacy , near universal male education , and ability of merchants to rely upon and trust family members living in different regions and countries .",Jewish economic activity,1
166,Where is the biggest Buddha statue in Europe ?,the biggest Buddha statue in Europe,"The Pagode de Vincennes Buddhist temple , near Lake Daumesnil in the Bois de Vincennes , is the former Cameroon pavilion from the 1931 Paris Colonial Exposition .","The Pagode de Vincennes Buddhist temple , near Lake Daumesnil in the Bois de Vincennes ,",0
167,In what year was the British protectorate over British Somaliland ended ?,the British protectorate over British Somaliland,"Following World War II , Britain retained control of both British Somaliland and Italian Somaliland as protectorates .",World War II,1
