,sentence1,source1_np0,sentence2,source2_np0,hard_neg,hard_neg_source_np0
217,Comments regarding enforcement issues and questions raised by the regulated industry were addressed by EPA in four Detergent Rule Question and Answer Documents .,Comments regarding enforcement issues and questions raised by the regulated industry,The four Detergent Rule Question and Answer Documents addressed enforcement issues and questions raised by the regulated industry .,The four Detergent Rule Question and Answer Documents,The EPA did not address the issues and questions of the regulated industry .,The EPA
218,"The Ottoman Empire surrendered when World War I ended the following year , and , following a declaration by the League of Nations ( the forerunner to the United Nations ) , Britain became rulers of Palestine by mandate .",The Ottoman Empire,The decision for Britain to become the rulers of Palestine was made by the League of Nations .,The decision for Britain to become the rulers of Palestine,The League of Nations forced the Ottoman Empire to surrender control of Palestine .,The League of Nations
219,"Inside , a huge mountain of a man , even bigger than Thorn , fought with a huge two - handed axe .","a huge mountain of a man , even bigger than Thorn ,",The man was extremely large .,The man,The man was fighting with a lance .,The man
220,Jon had only seen two people move that fast in his life,two people,Jon hadn ' t seen many people move that fast before .,many people,Jon knew at least 500 people with the same speed .,at least 500 people with the same speed
221,We developed technical assistance funds for creative planning projects and obtained a $ 15 .,technical assistance funds for creative planning projects,We received $ 15 dollars for our hard work .,$ 15 dollars for our hard work,No technical assistance funds for creative projects were developed .,No technical assistance funds for creative projects
222,"I have done my best to target unpopulated areas at unpopulated times , but the guilt still weights heavy on my soul . '",the guilt,"I have tried to hit unpopulated areas , but I still feel bad .",unpopulated areas,He tried to kill many people .,many people
223,"5 billion , but households ' wealth declined by nearly $ 842 billion ( 2 percent ) largely as a result of the drop in the market value of households ' stock holdings .",households ' wealth,The value of households ' stock holdings dropped and this contributed to a decline in household wealth .,The value of households ' stock holdings,"Because of the bull market , household wealth increased by over a trillion dollars .",household wealth
224,Auditors will need to exercise professional judgment in assessing the significance of audit results or findings .,professional judgment,Auditors need to apply their experience in assessing the significance of audit results .,their experience,Auditors are not responsible for the assessment of audit results .,the assessment of audit results
225,"Although a great deal of attention has been paid to the wealth effect from the stock market boom of the 1990 s , half of American households did not own stocks as of 1998 , according to the 1998 Survey of Consumer Finance .",half of American households,There was a Survey of Consumer Finance in 1998 .,a Survey of Consumer Finance,There was no stock market boom in the 1990 s .,no stock market boom
226,"Moreover , the realignment will help us to enhance our longterm capacity by improving recruitment and retention ; building a succession plan ; focusing on emerging issues ; and leveraging technology opportunities for improvements to clients , processes , and employees .",the realignment,Long term capacity will be improved by the realignment .,Long term capacity,Short term capacity will be harmed due to the realignment .,Short term capacity
227,The lot upon which it is being built had been vacant .,The lot upon which it is being built,The lot had been vacant .,The lot,The lot had been sold .,The lot
228,that if i were living in Mexico and trying to raise several children and i could see across the border where the good life would be for my children,the border,If I lived in Mexico I could see that the good life is across the border .,the good life,I believe Mexico is the best place to raise children .,the best place to raise children
229,"Or he hasn ' t really thought it through , which itself would cast doubt on the depth of his faith .",the depth of his faith,His faith may be lacking .,His faith,His faith is unwavering and he has taken into account every possible example .,His faith
230,Network externalities are in .,Network externalities,Unseen benefits to the network are popular .,Unseen benefits to the network,Network externalities are out,Network externalities
231,We could use their assistance should it be needed .,their assistance,We might need some help .,some help,We will definitely need help every evening .,every evening
232,Not a pleasant prospect and not one easily avoided - - - not even by any reform package or proposal that I ' ve seen .,Not a pleasant prospect,No reform package can help avoid the prospect .,No reform package,The prospect can be avoided by simply following the very valid proposals received .,The prospect
233,um - hum yeah i end up well yeah i mean i do a lot of like even weekender kind of things i go out for just one or two nights uh it ' s not my favorite thing but i can do it a lot more often so like over at the uh particularly in the uh the fall and spring when the insects haven ' t come out yet uh where they ' re already gone uh you know i spend almost every weekend up in the mountains and i guess i live about five hours away from some place to go hiking where i am now,i do a lot,I don ' t mind camping for a couple nights in the fall and spring .,a couple nights,I avoid going up into the mountains on weekends .,the mountains
234,The result was the four Raphael Rooms ( Stanze di Raffaello ) .,The result,There are four Raphael Rooms .,four Raphael Rooms,The result was 3 Raphael Rooms .,The result
235,"Nonetheless , based on discussions with several states , the application review process is estimated to take approximately 38 weeks ( 9 - 10 months ) .",the application review process,Around 9 or 10 months is the estimated time for the review process .,Around 9 or 10 months,The application review process was discussed only with corporations .,The application review process
236,"Acidic deposition or acid rain occurs when SO2 and NOx in the atmosphere react with water , oxygen , and oxidants to form acidic compounds .",Acidic deposition or acid rain,SO2 and NOx in the atmosphere cause acid rain .,SO2 and NOx in the atmosphere,Water and nitrogen in the atmosphere cause the acid rain .,Water and nitrogen in the atmosphere
237,"Pointe Pitre ' s cathedral , the Basilique Saint - Pierre et Saint - Paul , features unusual metal columns and balconies .","Pointe Pitre ' s cathedral , the Basilique Saint - Pierre et Saint - Paul ,",Unusual metal columns and balconies can be found on the cathedral in Pointe Pitre .,Unusual metal columns and balconies,The unusual polystyrene columns and balconies of the Basilique Saint - Pierre et Saint - Paul can be found in Pointe Pitre .,The unusual polystyrene columns and balconies of the Basilique Saint - Pierre et Saint - Paul
238,"Had that piquant gipsy face been at the bottom of the crime , or was it 73 the baser mainspring of money ?",the baser mainspring of money,Was that gipsy face responsible for the crime ?,that gipsy face,The gipsy face was the victim of the crime .,The gipsy face
239,i would sort of like to uh think about something in the way of uh uh sort of a sporty car but not any not you know a luxury type sporty one but um,something in the way of uh uh sort of a sporty car but not any not you know a luxury type sporty one,"I ' m interested in buying a sports car but not a very expensive , flashy one",a sports car,"I ' m thinking about a very functional , ordinary type of car but I wouldn ' t mind a luxury car either",a luxury car
240,Major tourist shops have forms and details .,Major tourist shops,Forms can be found at major tourist shops .,major tourist shops,The major tourist shops don ' t have forms .,The major tourist shops
241,Randy ' s Tough Love Wrap - Up,Randy ' s Tough Love Wrap,The Wrap - up of Randy ' s Tough Love .,The Wrap,Unconditional love by Randy .,Unconditional love
242,yeah i ' m in North Carolina,North Carolina,I ' m in North Carolina .,North Carolina,I ' m in South Carolina .,South Carolina
243,"He has so much experience and , as shown by the last interview , there are a lot of us out there who could benefit from it .","so much experience and , as shown by the last interview , there are a lot of us out there who could benefit from it",Many of us could benefit from t he experience he has .,Many of us,It was obvious from the interview that he was not very experienced and people should not look up to him .,the interview
244,"Serious auto racing arrived in Las Vegas in 1996 with the opening of the Las Vegas Motor Speedway , 17 miles ( 27 km ) north of Downtown on Interstate 15 .",Serious auto racing,Las Vegas saw the introduction of serious car racing in 1996 .,Las Vegas,Las Vegas has never had serious car racing introduced to it as a city .,Las Vegas
245,"He was watching Muller as if the sergeant , rather than his men , was the focal point of any future attack .","the sergeant , rather than his men ,","As if the sergeant , rather than his men , was the focal point of any future attack , he was watching Muller .","the sergeant , rather than his men ,","He was watching his men , as they were a focal point of any future attack .",his men
246,Sophisticated research is required to tease apart the complex interactions between These variables .,Sophisticated research,The variables interact in complex ways that are difficult to separate .,The variables,The variables are actually quite simple and easy to understand .,The variables
247,they use the the injection thing or whatever it is,the the injection thing or whatever it is,They use lethal injection .,lethal injection,They use the electric chair .,the electric chair
248,"He was here less than two days and already he thought of this town as home , something he wished to protect .",less than two days,The town was something the man wanted to guard .,The town,The man left the town after 24 hours .,The man
249,""" All whose true names they could find , that is , "" Garm amended .",All whose true names they could find,Everyone ' s true name they could find .,Everyone ' s true name,They found no one ' s true name .,no one ' s true name
250,"Since 1917 , Grand Central Market ( at 317 South Broadway ) has provided the city with a daily cornucopia of enticing fresh produce , fish , poultry , meat , and exotic foodstuffs .",Grand Central Market ( at 317 South Broadway ),The Grand Central Market has been known to give the city a daily cornucopia .,The Grand Central Market,Up until 1917 was when the Central Market gave away free food .,the Central Market
251,"According to HUD staff , after the Economic Analysis was submitted to OMB , HUD made changes in the Analysis to maintain its consistency with the rule , to which minor changes had been made as described below .",changes in the Analysis,HUD made some changes to the Economic Analysis .,some changes,The Economic Analysis was never handed to OMB .,The Economic Analysis
252,"When he married in 1901 , he and his wife ( Olga Knipper of the Moscow Art Theater ) went directly from the ceremony to a honeymoon in a sanitarium .",he and his wife ( Olga Knipper of the Moscow Art Theater ),His honeymoon was in a sanitarium .,His honeymoon,His wife has never went to a sanitarium .,His wife
253,2 ) House Judiciary Committee Chairman Henry Hyde said he has begun to examine impeachment procedures in the event they are justified .,House Judiciary Committee Chairman Henry Hyde,Henry Hyde is working on a law case .,Henry Hyde,Henry Hyde is not considering impeachment .,Henry Hyde
254,"A few schools , including Harvard , New York and Georgetown universities , already have them .","A few schools , including Harvard , New York and Georgetown universities ,","They are already in Harvard , New York and Georgetown universities .","Harvard , New York and Georgetown universities",There are no schools that have them as of yet .,no schools that have them as of yet
255,"In such circumstances , auditors may issue a limited official use report containing such information and distribute the report only to those parties responsible for acting on the auditors ' recommendations .",such circumstances,Auditors can issue a limited official use report that has such information .,a limited official use report that has such information,Auditors can issue a comprehensive official use report that has such information .,a comprehensive official use report that has such information
256,The point isn ' t that polls are dishonest .,The point,Dishonest polls is not the point being made .,Dishonest polls,The point that is being made is about dishonest polls .,The point that is being made
257,APHIS rejected the first alternative because it believed scientific evidence permitted importation of beef from Argentina under certain conditions and not permitting such importation would be contrary to trade agreements entered into by the United States .,the first alternative,The scientific evidence should that is is bad .,The scientific evidence should that is,The trade agreements would be in conjunction with the agreement .,The trade agreements
258,"He was writing a warning , not a prescription .","a warning , not a prescription",A warning was written .,A warning,He wrote out a prescription for pain killers .,a prescription for pain killers
259,"119 Cynthia was back from the hospital , and I placed my chair beside her , and told her of Poirot ' s wish to visit the dispensary .",my chair,Poirot wanted to visit the dispensary at the hospital where Cynthia worked .,the dispensary at the hospital where Cynthia worked,"Poirot talked to Cynthia himself , asking to visit her at work at the hospital .",Cynthia himself
260,"Rips was sufficiently enraged by Statistical Science ' s acceptance of the rebuttal paper that he retained a lawyer , who advised the journal that the accusations in the article about to be published . . .",Statistical Science ' s acceptance of the rebuttal paper,Rips was enraged by Stastical Science ' s acceptance of the rebuttal so he retained a lawyer who would advise the journal that accusations about to be published . . .,Stastical Science ' s acceptance of the rebuttal,Rips was happy with Stastical Science ' s acceptance of the rebuttal so he felt no need to retain a lawyer .,Stastical Science ' s acceptance of the rebuttal
261,i think on the local elections it ' s actually um i think um i think people vote in the larger elections because they feel like well you know the country ' s real important and you know if i elect if we help elect a president who ' s going to save us then the then the whole country will be saved but they figure local elections don ' t mean that much i suspect so people don ' t really worry about their local mayor or something figuring that you know um and i think wrongly figuring that that well what good is another mayor going to do anyway because our federal taxes are more important right now and you know and stuff like that so people think that that that they don ' t have um that that it doesn ' t doesn ' t matter as much whereas i think it ' s probably just the opposite is true i think it ' s probably the case that people could have more effect on a local level,the local elections,I think more people vote during the presidential elections than local elections .,more people,I think people should only vote for the presidential elections .,the presidential elections
262,Kashmir remained an unresolved problem of Partition .,an unresolved problem of Partition,The partition problem of Kashmir remained unresolved .,The partition problem of Kashmir,There was no partition problem in the Kashmir area .,no partition problem
263,"Given the assumptions and economic drivers in each of the scenarios , the AMIGA model calculates the capital investment , operation and maintenance , and fuel costs necessary to meet consumer demand for electricity .",the AMIGA model,The AMIGA model finds the capital investment .,The AMIGA model,The AMIGA model can not find the capital investment .,The AMIGA model
264,and then i have a cauliflower that i would cook garlic bread green salad tea and we ' d have a lemon pie for dessert,a cauliflower that i would cook garlic bread green salad tea,"I will make cauliflower , garlic bread , and green salad with tea to drink , and lemon pie for dessert .",garlic bread,I will make roast beef with green beans and no dessert for dinner .,roast beef with green beans
265,"All the discoveries have been made by Japp , and Japp will take all the credit .",All the discoveries,"Japp is the one who will be honored for the discoveries , and rightly so .","the one who will be honored for the discoveries , and rightly so","Japp made no discoveries , and will not be honored .",no discoveries
266,"For Columns 5 though 8 , the only amounts that change in lines 1 and 2 , compared to columns 1 through 4 , are outbound attributable cost and inbound revenue .",Columns 5 though 8,Only the outbound attributable cost and inbound revenue change in lines 1 and 2 in columns 5 through 8 .,inbound revenue change,There are no differences seen between line 1 and line 2 in any column .,no differences seen between line 1 and line 2 in any column
267,"You did not mention his name this afternoon , or I would have suggested your going to him for further information with my card as introduction .",his name,I could have helped to introduce you to him if you had told me his name .,his name,He does not have any additional information that would help you .,any additional information that would help you
268,This brought forth a small number of articulate dissensions .,a small number of articulate dissensions,This brought forward some dissent .,some dissent,This brought up happy feelings and warmth .,happy feelings and warmth
269,oh yeah no that ' s uh that ' s a that ' s a real interesting movie and it ' s got a good historical perspective to it,no that ' s uh that ' s a that ' s a real interesting movie,That was a very interesting movie .,a very interesting movie,That movie was the most boring thing I have ever watched .,That movie
270,"Meanwhile , lawyers were at a premium Indians love litigation and it was ideal training for future politicians and politics had been clandestine , because it was so often fatal to express an opinion on the wrong ( i . e . , losing ) side .",ideal training for future politicians and politics,Lawyers were at a premium and it was ideal training for future politicians and politics .,ideal training for future politicians and politics,There were no lawyers needed at all .,no lawyers needed at all
271,"In some states , it may be possible to develop and implement statewide initiatives to improve service delivery , increase resources , and enhance the capacity of the system to meet the civil legal needs of all low - income people without altering service areas or historical relationships .",some states,Statewide initiatives may be necessary for improving delivery service .,Statewide initiatives,In no states will it be necessary to develop and implement statewide initiatives .,no states
272,my dad ' s got a new um i guess it ' s an eighty nine or ninety uh Chrysler something or other it ' s one those transverse mounted V sixes front wheel drive,my dad ' s,My dad has a new eighty nine or ninety Chrysler with a transverse mounted V and front wheel drive .,My dad,My father just bought a brand new Toyota truck .,My father
273,"Five forks guarantee real comfort , but the food will not necessarily be better than in a two - or three - fork establishment , just more expensive .",Five forks,"Five fork restaurants may not have better food than a two or three fork restaurant , they are just more expensive .",Five fork restaurants,The food is way better at a five fork restaurant than at a two or three fork one .,The food
274,"This is a colourful Middle Eastern - Yemenite restaurant ( where the downstairs is expensive , and the upstairs is less formal ) with an interesting menu of meat and offal .","a colourful Middle Eastern - Yemenite restaurant ( where the downstairs is expensive , and the upstairs is less formal ) with an interesting menu of meat and offal",The restaurant serves Middle Eastern - Yemenite food .,The restaurant,The restaurant serves Italian food .,The restaurant
275,Table 7 - 1 shows a summary of resource demand and its effect on current supply .,Table 7 - 1,The table shows a summary of the resources in demand .,The table,The table shows a summary of the resources with supplies . .,The table
276,"Age , Health , and the Willingness to Pay for Mortality Risk A Contingent",the Willingness to Pay for Mortality Risk A Contingent,"Age , Health , and the Willingness to Pay for Mortality Risk A Contingent are all related topics .","Age , Health , and the Willingness to Pay for Mortality Risk A Contingent","Age , Health , and the Willingness to Pay for Mortality Risk A Contingent have nothing to do with each other .","Age , Health , and the Willingness to Pay for Mortality Risk A Contingent"
277,"Of course , there is always the chance that the company ' s management has simply gone mad .",the chance that the company ' s management has simply gone mad,It is possible that the company ' s management has gone crazy .,the company ' s management,It ' s possible that the company is not affected at all .,the company
278,This factual record provided an important context for consideration of the legal question of the meaning of the presence requirement .,This factual record,The record gave context that was important for legal questioning .,The record,The record gave no context regarding the legal question .,The record
279,The rest of the industry is waiting to see how much control the government demands over recovered keys .,The rest of the industry,The industry waits to see how much control the government holds .,The industry,The industry waits for nothing .,The industry
280,The mosque is unusual in Cairo in that it has no facade it is hidden behind a protective wall with nineteen openings .,The mosque,The mosque in cairo is protected by walls .,The mosque in cairo,"The mosque has a facade , but no protective wall .",The mosque
281,"Warn ' t no Apaches , that ' s for certain .","no Apaches , that ' s for certain","It wasn ' t the Apaches , certainly .",the Apaches,It was definitely the Apaches .,the Apaches
282,The Commission prepared a Final Regulatory Flexibility Analysis pursuant to section 604 .,The Commission,The Commission put together a Final Regulatory Flexibility Analysis .,The Commission,The Commission put together a Final Regulatory Flexibility Analysis that went against Section 604 .,The Commission
283,"Kuala Kangsar has long been famous for Malay College , set amid spacious grounds near the center of town , a prestigious and exclusive school for the Malay aristocracy since it was founded by the British in 1904 .",Kuala Kangsar,The Malay aristocracy went to the prestigious Malay college .,The Malay aristocracy,Malay College was know for taking in any student regardless of their background .,Malay College
284,"By the 11 th century , the caliphate had splintered into a mosaic of fractious states 26 at one point , and the Balearics became an independent emirate .",the 11 th century,The caliphate broke into a number of states by the 11 th century .,The caliphate,The caliphate stayed as a united front until long after the 11 th century .,The caliphate
285,right i think we ' d have the same type of problem say with Mexico uh Canada on the other hand uh English is one of their national languages they have,the same type of problem,We probably have the same issues as Mexico and Canada with regards to the use of the English language .,the same issues as Mexico and Canada,We share the same struggles as Russia .,the same struggles as Russia
286,In this paper we examine the hypothesis that the cost model provides reasonable estimates of the unit costs of other posts of industrialized countries .,this paper,Postal services of industrialized foreign countries are monitored .,Postal services of industrialized foreign countries,It isn ' t possible to estimate costs without going through the budget office of each country .,the budget office of each country
287,Should the intervention include the family ?,the intervention,Do interventions need the family to be present ?,the family,Should the intervention include the girlfriend ' s family ?,the intervention
288,"These laws emphasize involving senior executives in information management decisions , appointing senior - level chief information officers , and using performance measures to assess the contribution of technology in achieving mission results .",These laws,There are laws that involve senior executives who make information management decisions .,laws that involve senior executives who make information management decisions,There are no laws that involve senior executives who make information management decisions .,no laws that involve senior executives who make information management decisions
289,"It was a smaller room than the one downstairs , and there was something peculiarly airless about the atmosphere of it .",a smaller room than the one downstairs,The room was smaller and felt especially suffocating .,The room,"The room was large and welcoming , cozier than the room downstairs .",The room
