,sentence1,source1_np0,sentence2,source2_np0,hard_neg,hard_neg_source_np0
290,"A delightful series of dioramas then introduce Peter Rabbit , Mrs . Tiggi - Winkle , and Squirrel Nutkin , among others , set in scenes taken from Potter ' s books .",A delightful series of dioramas,"A series of dioramas taken fro Potter ' s books introduced Peter Rabbit , Mrs . Tiggi - Winkle , and Squirrel Nutkin .",A series of dioramas taken fro Potter ' s books,The delightful series of dioramas depict scenes from the books of several authors .,The delightful series of dioramas
291,"He held out a hand to the salamander , petted it to a gentle glow and put it back over Dave ' s chest .",the salamander,There was a salamander on Dave ' s body .,Dave ' s body,His actions were hostile towards the salamander .,His actions
292,"Its principal scandal reporter , Ambrose Evans - Pritchard , has published lots of stories on the suicide .","Its principal scandal reporter , Ambrose Evans - Pritchard ,",Someone has been publishing stories on a suicide .,stories on a suicide,The stories were about a homicide victim .,The stories
293,"Jon ran behind a building not yet aflame , the house where Susan had stayed a few days earlier , and prayed to any god who might be listening that they would not find any enemies behind it .","a building not yet aflame , the house where Susan had stayed a few days earlier",Jon ran behind a building that had not yet caught on fire .,a building that had not yet caught on fire,Every building was on fire .,Every building
294,"In her soft grey frock , with white ruffles at the wrists falling over her slender hands , she looked very beautiful .",her soft grey frock,"She appeared exquisite in her frock , with ruffles covering her delicate hands .",her frock,She looked hideous in her frumpy gown .,her frumpy gown
295,and uh i have a few health food stores that i send it to i can buy the cookies in a larger quantity than they can so i can get a deal from the uh from the main from the supplier,a few health food stores that i send it to i can buy the cookies in a larger quantity than they can so i can get a deal from the uh from the main from the supplier,There are a few health food stores that can buy the cookies in bulk for a better deal .,a few health food stores that can buy the cookies in bulk for a better deal,I don ' t know of any way to purchase the cookies for a better deal .,any way to purchase the cookies for a better deal
296,"Seemed that whoever the killer was , she ' d let him into her home voluntarily .",the killer,It seems like the killer was invited in .,the killer,The killer broke a window in order to enter the home .,The killer
297,and even the painter couldn ' t give me a good estimate he said well i ' ll be done this afternoon you know,even the painter,The painter could not tell me a rough guess .,The painter,The painter told me exactly when they were going to finish .,The painter
298,There ' s a pile of money called the Social Security Trust Fund .,a pile of money called the Social Security Trust Fund,The Social Security Trust Fund is made up of money .,The Social Security Trust Fund,The Social Security Trust Fund is a big sack of earlobes .,The Social Security Trust Fund
299,"Dave Hanson , to whom nothing is impossible , he said .","Dave Hanson , to whom nothing is impossible ,",He said Dave Hanson .,Dave Hanson,"Jim Crusher , to which everything was impossible , he said .","Jim Crusher , to which everything was impossible ,"
300,"If Moynihan has anything to do with it , Al Gore will not get Bill Clinton ' s .",Al Gore,Al Gore may or may not get Bill Clinton ' s .,Al Gore,Bill Clinton may get Al Gore ' s if Moynihan has anything to do with it .,Bill Clinton
301,expressed about the methodology and results of the procedures to determine the federal pay gap .,the methodology and results of the procedures to determine the federal pay gap,The methodology and results were used to determine the federal pay gap .,The methodology and results,"Nothing was used to determine the pay gap , they just guessed .",the pay gap
302,"Old salts may want to skipper their charter craft acroseopen sea to the smaller Dutch islands of Sint Eustatius or Saba , or to French Saint - Barthelemy .",Old salts,If you are looking for a different options you can take your charter ship to one of the less popular islands nearby .,your charter ship,There is no way to visit smaller islands during your stay .,no way to visit smaller islands during your stay
303,"Tomb 57 , that of Khaemhat , was decorated with statues of himself and his family very rare for tombs of his class .","Tomb 57 , that of Khaemhat ,",The tomb was decorated with statues .,The tomb,Tomb 57 is a very common tomb .,a very common tomb
304,"Chambers developed increasing reservations in his later years about the direction the American right was taking , distancing himself first from Joe McCarthy , then from Richard Nixon , and even from William Buckley Jr . ' s National Review . But Chambers ' importance lies , finally , not in his politics but in his romantic penchant for the extremes of the psychic and political undergrounds .",increasing reservations,Chambers built a wall between himself and McCarthy and Nixon .,himself and McCarthy and Nixon,"Chambers developed a closer bond to McCarthy and Nixon , during his later years .",a closer bond to McCarthy and Nixon
305,Thank you . Tuppence felt a terrific rise in her spirits .,a terrific rise in her spirits,Tupperence felt better after this event .,this event,Tupperence felt worse at the end of this interaction .,the end of this interaction
306,The place was a living tomb … .,The place,It was no more than a living tomb .,no more than a living tomb,It was a cheerful place .,a cheerful place
307,The dramatically rising cliff of black basalt stone made the castle impregnable to all but the most wily commander .,The dramatically rising cliff of black basalt stone,The castle was secure due to its proximity to a cliff .,The castle,The castle could be easily invaded by almost anyone .,The castle
308,He gasped for air and his head throbbed .,his head,His head hurt terribly .,His head,"He took a deep , easy breath .","a deep , easy breath"
309,"If food and medical care tripled in cost , people would of necessity spend less on other things to pay for the increase or cut down on the food and medical care they purchased .",food and medical care,People would have to cut spending in other areas if food and medical care increased .,other areas,People would just go without food or medical care if the costs tripled .,food or medical care
310,"In that regard , they evaluated a set of about 50 policies to improve the technology performance and characterization of the residential , commercial , industrial , transportation , and electricity generation sectors .",that regard,Around fifty ( 50 ) policies were evaluated for the improvement of technological performance .,Around fifty ( 50 ) policies,All 50 policies improved only the commercial sector .,All 50 policies
311,"Authentic Jamaican cuisine ( including jerk chicken , pork , and fish ) , or choose your own lobster .",Authentic Jamaican cuisine,Jamaican cuisine includes jerk chicken .,Jamaican cuisine,Jamaican cuisine is not served at the resort .,Jamaican cuisine
312,"Now , the resort and hotel complex is variously described as simply noisy to a one - stop destination for fantasy , excitement , and adventure ; your conclusion obviously depends on your point of view .",the resort and hotel complex,The resort and hotel complex has been described as noisy .,The resort and hotel complex,The resort and hotel complex are very quiet .,The resort and hotel complex
313,"Given the extent of wealth it has brought to the country , it is not surprising to have a Natural Rubber Museum , which opened since 1992 at the Rubber Research Institute ' s Experimental Station in Sungai Buloh .",the extent of wealth it has brought to the country,Natural rubber has brought wealth to the country .,Natural rubber,Rubber has not contributed to the wealth of the country .,the wealth of the country
314,"Encapuchadores bind these male trees in spring to produce the pale , bleached fronds that are used in Palm Sunday celebrations .",these male trees,There are celebrations on Palm Sunday .,Palm Sunday,There are no celebrations on Palm Sunday .,no celebrations on Palm Sunday
315,up to a forty four magnum any any of them in the correct hands they ' re an absolutely fantastic weapon,any any of them,A 44 magnum is a great weapon .,A 44 magnum,A 44 magnum is a total piece of junk .,A 44 magnum
316,I beg your pardon . A man ' s voice beside her made her start and turn .,A man ' s voice beside her,She was startled by the man and turned when he said I beg your pardon .,the man,She was expecting the man next to her to speak and wasn ' t surprised when he did .,the man next to her to speak
317,"However , an interim program was instituted between April 4 and October 4 , 1996 , to maintain a basic program until EQIP could begin .",an interim program,They had a temporary program in place .,a temporary program,They were not able to keep the program going .,the program
318,"The Zapruder family is demanding $ 18 million , wanting no blood money but figuring it could fetch $ 70 million on the open market .",The Zapruder family,The Zapruder family wants lots of money .,The Zapruder family,The Zapruder family wants nothing in return .,The Zapruder family
319,Around him stood the remainder of the Sticks .,the remainder of the Sticks,The rest of the Stick stood around him .,The rest of the Stick,There weren ' t any members of the Sticks left .,any members of the Sticks left
320,He scanned the great lawyer eagerly .,the great lawyer,He looked at the lawyer .,the lawyer,He ignored the lawyer .,the lawyer
321,Most organized tours generally include a night at a gazino as part of the package ; otherwise you can book a table through your hotel or through a travel agent .,Most organized tours,Most tours include a gazino night when booking .,Most tours,"No tours include a gazino night , you can ' t book one .",No tours
322,"I ' m in a huge , overwhelming sea of debt , said Jennifer Arons , 28 , a criminal defense staff attorney at Manhattan Legal Aid .","Jennifer Arons , 28 , a criminal defense staff attorney at Manhattan Legal Aid",At least one of Manhattan Legal Aids ' criminal defense staff is overwhelmed by debt .,At least one of Manhattan Legal Aids ' criminal defense staff,"Despite it ' s name , Manhattan Legal Aid does not involve anyone remotely connected to the judicial process .",Manhattan Legal Aid
323,CDC Centers for Disease Control and Prevention CERT / CC CERTa Coordination Center,CDC Centers,CDC stands for Centers for disease control .,Centers for disease control,CDC stands for Colons for diabolical control .,diabolical control
324,and uh when i played softball it was with the church team it was just for fun although the church team we made it to the nationals we were ranked fifteenth in the nation so i you know i ' m proud of that,i you,I played softball with the church team for the fun of it .,the church team,I have never played softball a day in my life .,my life
325,It was at that moment that the full realization of his folly began to come home to Tommy .,that moment,He then realized the folly .,the folly,There was no realization of the folly .,no realization of the folly
326,that it would just have to be a hobby and i ' m i ' m very mechanical and mechanical engineering interested me so i did that and then i you know i did that for six years and then i stayed home with my son and did nothing and found out that i was that you know it was great but i was bored part of the time too and i wanted something else,i you,I am a mechanical engineer that needs more hobbies .,a mechanical engineer that needs more hobbies,I am entirely satisfied with my mechanical engineering job .,my mechanical engineering job
327,um - hum yeah it ' s kind of it ' s kind of strange here the way things go uh here if you have an accident and no one ' s injured the police won ' t even show up,the way things,The police don ' t show up if nobody is injured .,The police,The police fight fires .,The police
328,but uh Yount has been a he ' s a player uh year in year out and always uh is leading the team in uh most of most of their offensive categories,a he ' s a player uh year in year out,Yount is leading the team in a lot of their offensive categories .,the team,Yount has not been very helpful with their offensive categories .,their offensive categories
329,"This is very sad news , but you will excuse me if I say that I do not see how it bears on the subject of your inquiry ?",very sad news,The speaker does not care about the sad news .,The speaker,The sad news allows for the person to change the subject of the inquiry .,The sad news
330,The next witness was Mary Cavendish .,The next witness,There was another witness .,another witness,The woman was not a bystander to anything .,The woman
331,and you got to have your cranberry sauce now i like jellied kind,jellied kind,You have to have the jellied cranberry sauce .,the jellied cranberry sauce,"I only like homemade cranberry sauce , not the jellied kind .","homemade cranberry sauce , not the jellied kind"
332,plant that emits 0 . 1 pounds of mercury and a plant that emits 2000 pounds of mercury - regardless of cost - is neither efficient nor necessary .,plant that emits 0 . 1 pounds of mercury and a plant that emits 2000 pounds of mercury - regardless of cost -,Plants that emit mercury are not necessary .,Plants that emit mercury,Mercury producing plants are the most efficient kind .,Mercury producing plants
333,it really is our kids are all grown and gone and away from home so our our new family is the you know our two cats and our dog we never really well we had we did have some time to devote to them you know but not nearly as much time as we have now so they ' ve really become children they ' re they ' re real characters they really well all of them are,our kids are all grown and gone and away from home,"Since our kids are all grown and gone , we have the pets to fill their spots .",the pets to fill their spots,"Since I am allergic to dogs and cats , we don ' t own any .",dogs and cats
334,no um my husband has a grandmother in a nursing home and that has been a real mess to say the least,my husband,My spouse ' s grandmother is in a nursing home and it ' s been a disaster .,My spouse ' s grandmother,It ' s been a dream once we moved my husband ' s grandmother into the nursing home .,my husband ' s grandmother
335,but uh because i work for uh Hal Ammon,uh Hal Ammon,I work for Hal Ammon .,Hal Ammon,I don ' t work for Hal Ammon .,Hal Ammon
336,yeah the current average or whatever,the current average or whatever,Yeah the average right now .,the average right now,The average from a decade ago .,The average
337,"She had decided not to ask if Sir James was "" at home , "" but to adopt a more personal attitude .",Sir James,She decided to use a more personal attitude when asking if Sir James was at home .,a more personal attitude,"She straight up asked if Sir James was "" at home "" .",Sir James
338,Nor was a common start or end point identified for design review as an element of the facility acquisition process .,a common start or end point identified for design review as an element of the facility acquisition process,A common start or end point was not identified .,A common start or end point,A common start or end point was identified .,A common start or end point
339,"A company of handweavers has been working here since at least 1723 , and visitors are able to watch them at work , but their products have become less distinctive since they expanded into a popular tourist attraction .",their products,"Tourists can view the company of handweavers work , but the historic company have less distinctive products now due to becoming a popular attraction .",the historic company,"A company of handweavers used to work here dating back to 1723 , but they are no longer in business but you can see where they used to work .",A company of handweavers
340,"And so there are self - righteous demands for international labor We should not , the opponents of globalization insist , be willing to buy those sneakers and shirts unless the people who make them receive decent wages and work under decent conditions .",international labor,Opponents of globalization believe that people should refuse to buy goods made overseas unless the people making them are given a decent wage and better work conditions .,Opponents of globalization,There is very little demand for cheap goods through international labor .,very little demand for cheap goods
341,"Dublin is an intimate city , physically small but tightly packed , a perfect place for walking .","an intimate city , physically small but tightly packed , a perfect place for walking",Dublin is a dense city made for foot travel .,a dense city made for foot travel,Dublin is a city that spans a vast distance in every direction .,a city that spans a vast distance in every direction
342,You will be able to buy it at the giftshop adjacent to the ship on your visit .,the giftshop adjacent to the ship on your visit,You can buy the item at the giftshop on your visit .,the item,Unfortunately the giftshop is closed during this visit .,the giftshop
343,"A third Asian neighborhood , Koreatown , lies west of downtown along Olympic Boulevard between Vermont and Western avenues .","A third Asian neighborhood , Koreatown ,","Lying west of downtown is Koreatown , the third Asian neighborhood .","Koreatown , the third Asian neighborhood",The Olympic Boulevard is east of Koreatown and so is Vermont and Western avenues .,The Olympic Boulevard
344,The others followed .,The others,The others had followed someone .,The others,The others refused to follow .,The others
345,"Gigot thinks the tax fraud proceedings against Hubbell are legitimate and ordinary , while everyone else regards the indictments as trumped - up mini - crimes meant to squeeze Hubbell into giving Starr what he wants - - cooperation .",the tax fraud proceedings against Hubbell,There is a disagreement as to whether Hubbell ' s tax fraud charges are being conducted in a proper manner .,a disagreement as to whether Hubbell ' s tax fraud charges are being conducted in a proper manner,Everyone wants Hubbell to face the maximum punishment for participating in tax fraud .,the maximum punishment for participating in tax fraud
346,U . S . economic interests through the prevention and mitigation ofmarine incidents .,U . S . economic interests,Prevention of marine incidents for U . S . economic reasons .,Prevention of marine incidents,Complete stoppage of marine activity for the detriment of the US economic interest .,Complete stoppage
347,Room 5 holds objects from the final phase of Minoan civilization ( 1450 - 1400 b . c . ) .,the final phase of Minoan civilization,Room 5 contains ancient artifacts .,ancient artifacts,Room 5 has stuff from the middle ages .,the middle ages
348,"The magazine ' s humor often depended on racist and sexist stereotypes , such as wide - grinned , watermelon - eating blacks .",The magazine ' s humor,Racist and sexist humor were offered by the magazine .,Racist and sexist humor,The humor was not racist .,The humor
349,"When he looks back a year from now , Rubin said he hopes the foundation has new programs , a higher profile and a rejuvenated board .",a year from now,He wants the foundation to have a higher profile .,the foundation,Rubin said he wants the board to be lethargic .,the board
350,"But , says Lindburg , ' if you protect the panda , you ' re protecting the golden monkey , the monal pheasants , the takins .",the panda,"Lindburg stated that if you protect the panda , you protect other animals , too .",other animals,Saving the Panda will not help any other animals .,the Panda
351,"Adopting a unified approach to reduce SO2 , NOx and mercury is better than looking at each pollutant separately because of synergistic effects .","a unified approach to reduce SO2 , NOx and mercury","Since SO2 , NOx and mercury potentiate each other , a unified approach to reducing their levels is more accurate than considering them one by one .",a unified approach to reducing their levels,"Mercury , NOx , and SO2 are best considered in harm reduction by themselves , since they bear no relation to each other .","Mercury , NOx , and SO2"
352,"In the southeast corner of the courtyard is the Turkish Sultana ' s House , or Hujra - i - Anup Talao ( the Chamber of the Peerless Pool ) ; animals covering every wall panel and pillar create the illusion of woodwork rather than stone .","the Turkish Sultana ' s House , or Hujra - i - Anup Talao ( the Chamber of the Peerless Pool )",There are a number of animals on the wall panels .,a number of animals on the wall panels,The northeast corner has the Turkish Sulatana ' s House .,The northeast corner
353,It was refurbished in the Victorian era but rendered useless by succeeding Nile dams .,the Victorian era,The Nile dams destroyed the refurbishment of the Victorian era .,The Nile dams,The Nile damns were useless .,The Nile damns
354,Women are so large a part of the labor force that it is hard to believe that this could be true of the total if it were not also true of women .,so large a part of the labor force that it is hard to believe that this could be true of the total if it were not also true of women,It would be hard to think that it weren ' t true of the whole work force if it wasn ' t true of women .,the whole work force,Men are a huge part of the labor force so they are the only ones that matter .,a huge part of the labor force
355,yeah well i think they got i think that was almost everyone of them that he recruited uh recruited for this year,i think they,He recruited everyone for this year .,this year,No one he recruited was worth hiring this year .,No one he recruited
356,"here , where you should click the FIFA Online link , which you ' ll find on the left ( under THE BASICS ) .","the FIFA Online link , which you ' ll find on the left ( under THE BASICS )",The link to FIFA is on the left under THE BASICS .,The link to FIFA,"You ' ll have to click the FIFA link over to the right , above THE BASICS .",the FIFA link
357,"Town End is full of wonderful artifacts from 17 th - century daily life , such as cooking utensils bowls , pans , crockery , and hooks to hang hare and pheasants rag rugs made by the women of the household , and laundry implements such as a dolly used for stirring the clothes in the washing tub .",Town End,"There are many artefacts in Town End which date back to the 1600 s , including laundry tools and cookware .","many artefacts in Town End which date back to the 1600 s , including laundry tools and cookware",There are no artefacts from the 1600 s to be found in Town End .,no artefacts from the 1600 s to be found in Town End
358,She had come to know Betty Currie very well .,Betty Currie,"Over time , she began to know Betty Currie well .",Betty Currie,She had come to quite dislike Betty Currie .,Betty Currie
359,Why come here ? The torrent has started already and many other southern villages surely draw the interest of bandits .,The torrent,There were villages in the south .,villages in the south,The southern part of the country had no residents .,The southern part of the country
360,It took the advent of jetliners and cruise ships for that to happen .,the advent of jetliners and cruise ships,The jetliners caused it to happen .,The jetliners,There are no cruise ships in the area .,no cruise ships
361,uh Malaysia four years in Malaysia and three years in the Philippines,four years in Malaysia,Four years in Malaysia and three years in the Philippines .,Four years in Malaysia,Six years in Malaysia and two years in the Philippines .,Six years in Malaysia
362,Longabaugh noted that new and creative interventions may be developed in the ED that the rest of the field will want to adapt and explore .,new and creative interventions,The interventions developed in the ED will be picked up on by the rest of the field .,The interventions developed in the ED,The new interventions developed in the ED will not be adapted by the rest of the field .,The new interventions developed in the ED
363,"Adrienne Worthy , executive director of Legal Aid , said her agency will receive $ 400 , 000 less in federal funds in 2003 , because the 2000 Census found 30 , 000 fewer poor people in West Virginia .","Adrienne Worthy , executive director of Legal Aid ,",Federal funds are dependent upon the populous which they serve .,Federal funds,West Virginia provides no government assistance to citizens for legal matters .,West Virginia
364,"The show is at its best on weekend afternoons , with everything from beach boys on unicycles to rock musicians on roller blades .",The show,Weekend afternoons are when the show is at its best .,Weekend afternoons,The show is at it ' s best around midnight on the weekends .,The show
365,uh the ones we see are Americans by marriage a huge number here in Colorado Springs there ' s an Air Force base and an army base,the ones we see,There ' s an air force and army base in Colorado springs .,an air force and army base in Colorado springs,There aren ' t any army establishments in Colorado .,any army establishments in Colorado
