,sentence1,source1_np0,sentence2,source2_np0,hard_neg,hard_neg_source_np0
139,"In the violet shade of morning , Ca ' daan saw Adrin standing on the dunes in sword practice .",Ca ' daan,"With the sunrise casting a violet shade on the soil , Ca ' daan spotted Adrin on the dunes practicing his swordsmanship .",Ca ' daan,"Adrin was lost in the night as a swordsman chased after him that many knew as "" Ca ' daan "" .",the night
140,i bet even my cats could do that,even my cats,My cats could probably do that .,My cats,My cats would be incapable of doing such a thing .,My cats
141,"Southeast of Saint - Jean - de - Luz is Ascain , with a village square surrounded by enchanting 17 th - century houses and a typical wooden - galleried church .",Southeast of Saint - Jean - de - Luz,"The church , as was typical , has a wooden gallery .",The church,The church was built in the 20 th century .,The church
142,He distinctly said you were to repair the sky .,the sky,I heard him say that you had to fix the sky .,the sky,He only muttered something about splitting the sky .,something about splitting the sky
143,"Lorenzo the Magnificent and brother Giuliano lie in simple tombs beneath the sculptor ' s Madonna and Child , flanked by lesser artists ' statues of the family patron saints Cosmas and Damian .",Lorenzo the Magnificent and brother Giuliano,Lorenzo and Giuliano were related to one another .,Lorenzo and Giuliano,Lorenzo had no male family members .,no male family members
144,"It has a staff of about 100 employees , including attorneys and support staff , in 10 branch offices .","a staff of about 100 employees , including attorneys and support staff , in 10 branch offices",The 10 branches had close to 100 employees .,The 10 branches,Each branch had 100 employees .,Each branch
145,First we applied three alternative concentrationresponse ( C - R ) functions to estimate premature mortality incidence .,three alternative concentrationresponse ( C - R ) functions to estimate premature mortality incidence,We applied three alternative CR functions to estimate premature death incident .,three alternative CR functions to estimate premature death incident,No CR functions were applied to the incidence .,No CR functions
146,All we ' ve done is checked that the first two creditors divided their collective share of $ 125 appropriately,All we ' ve done,The first two creditors divided their shares correctly .,The first two creditors,The creditors are not allocating their shares correctly .,The creditors
147,"However , little evidence remains of that era some ceramics in the museum , a few fortifications , a network of irrigation ditches .",little evidence,There is little evidence left of that era .,little evidence left of that era,There is a surplus of ceramics left in the museum .,a surplus of ceramics left in the museum
148,", chief knowledge officers or chief technical officers ) that diffuse responsibility across several senior - level managers .",chief knowledge officers or chief technical officers,Chief officers often spread their responsibility among senior - level managers .,Chief officers,"The senior - level managers tend to be their own bosses , and often give some of their duties to the chief officers .",The senior - level managers
149,oh no well i don ' t find a lot of time to watch TV and a lot of the time i find it during the day when i ' m rocking my little girl to sleep so i watch a lot of reruns old shows,a lot of time to watch TV,"I don ' t watch TV often , usually just reruns when I ' m rocking my little girl to sleep .",just reruns,"I watch TV constantly throughout the day , except when my daughter is trying to sleep .",the day
150,The smart Annie was not in evidence .,The smart Annie,The clever Annie was not in proof .,The clever Annie,The smart Annie was fully in evidence .,The smart Annie
151,"Yes , Mistuh Reese , suh ?",Mistuh Reese,"Yes , Mr Reece ?",Mr Reece,He refused to talk to Mr Reece .,Mr Reece
152,Postal Service ' s domestic rates for First - Class and Priority Mail to the inbound mail distribution described above .,Postal Service ' s domestic rates,Usps domestic rates for priority and first class mail ate described above .,Usps domestic rates for priority and first class mail,The USPS does not describe their rates .,The USPS
153,do you like um any rock and roll at all,any rock and roll,What about rock and roll music ?,rock and roll music,So you don ' t like rock and roll ?,rock and roll
154,"Dining room , grill , pub .",Dining room,It has a dining room and grill .,a dining room and grill,It has a dining room but no grill .,a dining room but no grill
155,"But such a show would have meant the museum taking a hard look at its own , often controversial part in the art world .",such a show,Museums often take a controversial part in the art world .,a controversial part in the art world,Museums are not part of the art world .,part of the art world
156,"But you will find fishermen , many of whom are direct descendants of some 600 Genoese mercenaries King Charles III rescued from captivity on Tunisia ' s Tabarka Island , hence the name .","fishermen , many of whom are direct descendants of some 600 Genoese mercenaries King Charles III rescued from captivity on Tunisia ' s Tabarka Island , hence the name",Tabarka Island is part of Tunisia .,Tabarka Island,Tabarka Island is part of Turkey .,Tabarka Island
157,"And while we allow people to give a kidney to their child , we do not allow them to donate their heart .",their heart,"People are allowrd to donate a kidney to their child , but not their heart .",their heart,You definitely can donate a heart to your child .,your child
158,"The Commission is unwilling to recommend an interpretation of the statute that produces such consequences , absent an express congressional intent that such burdens be imposed .",The Commission,"Unless congress expresses an intent that such burdens be imposed , the Commission is unwilling to recommend an interpretation of the statute that produces such consequences .",the Commission,The Commission has no problem with recommending an interpretation of the statute that produces such consequences .,The Commission
159,My wife and daughter are the ones doing Riley .,My wife and daughter,The people performing Riley are my spouse and daughter .,The people performing Riley,My grandmother and grandmother ' s lesbian lover are doing Riley .,My grandmother and grandmother ' s lesbian lover
160,Take a backwaters trip through the lagoons and around the island villages .,a backwaters trip through the lagoons and around the island villages,Take a lagoon trip through the island villages .,a lagoon trip through the island villages,Don ' t waste time on the backwaters attraction .,Don ' t
161,"In a culture where Xena and Hercules have hit TV shows , it ' s a lot more fun imagining that you are a valiant warrior doing business - as - battle than it is to admit that you ' re a pudgy functionary whose most daring deed is to draft a boldly worded memo .",a culture where Xena and Hercules have hit TV shows,Xena and Hercules both have hit shows .,Xena and Hercules,Xena and Hercules both have failed shows .,Xena and Hercules
162,"Laibson ' s imperfect altruists face a far subtler problem - - they ' re not just weighing costs and benefits , they ' re engaged in games of strategy against their future selves .",Laibson ' s imperfect altruists,Laibson has alturists that follow him .,alturists that follow him,Laibson has selfish people that follow him .,selfish people that follow him
163,"The win brought tears to her eyes , of course , and prompted a phone call to Mom in India .",The win,"Following her win , she called her mom , who was in India , with tears in her eyes .",her win,"She called her father after she lost , smiling as she did it .",her father
164,"The New York Times ' Janet Maslin says the film works precisely because it is derivative - - its stars , Matt Dillon and Gary Sinise , emulate the characters in The Usual Suspects , which gives them extraordinary opportunities to preen .",The New York Times ' Janet Maslin,The movie stars Matt Dillon and Gary Sinise .,The movie,Janet Maslin has no association with the New York Times .,Janet Maslin
165,"The Muslim campaign for Partition was led by London - trained Bombay lawyer , Muhammad Ali Jinnah .",The Muslim campaign for Partition,The leader of the Muslim campaign was a Bombay lawyer named Muhammad Ali Jinnah .,The leader of the Muslim campaign,Muhammad Ali Jinnah went to London to campaign for Partition .,Muhammad Ali Jinnah
166,Automobile includes small trucks .,small trucks,Small trucks are considered as automobiles .,Small trucks,Airplane includes small trucks .,small trucks
167,"After its early failure , Hubble now provides vital clues to the universe .",its early failure,Hubble provides important clues to the universe .,important clues to the universe,Hubble provides useless information to the universe .,useless information
168,well they all come back from from the bottom,the bottom,They bounce back from the bottom .,the bottom,They never come back once they reach the bottom .,the bottom
169,A library with the maximum allowable e - rate subsidy of 90 percent would still find itself paying a monthly Internet bill of $ 186 .,A library with the maximum allowable e - rate subsidy of 90 percent,A library has a maximum subsidy of 90 % .,A library,A library has a minimum subsidy of 90 % .,A library
170,and i was never in a minor league city until i came Dallas we were a minor league city when i came here in fifty nine and i immediately bought season tickets uh to the class triple A uh uh Dallas Rangers,a minor league city,I considered Dallas to be a minor league city when I arrived .,a minor league city,Dallas was always in the majors .,the majors
171,The SPAN A Guide to Legal Services Planning .,The SPAN A Guide,The SPAN A guide is a guide used for legal service planning .,The SPAN A guide,The SPAN A guide is is a cook book .,The SPAN A guide
172,The Citizens of the United States of America have a right to applaud themselves for having given to mankind examples of an enlarged and liberal a policy worthy of imitation .,The Citizens of the United States of America,The citizens of the U . S . are supposed to be proud of themselves .,The citizens of the U . S .,The citizens of the U . S . should be ashamed of themselves .,The citizens of the U . S .
173,"Leave the river briefly to loop east around Talcy , with its Romanesque church and the 13 th - century chateau of Thizy , before ending your trip at Montr ? ? al .",the river,It is recommended that you leave river briefly before ending your trip at Montréal .,your trip at Montréal,"There is no river running around Talcy , only mountains and hills .","no river running around Talcy , only mountains and hills"
174,yeah and i you know i think defense really is what wins wins uh in the long run you can have the best half back there is or the best quarterback but if they don ' t have any blocking maybe they can ' t do anything,i you,I think a good defense is the most important thing you need to win games .,a good defense,I think the most important part of a football team is the quarterback .,the most important part of a football team
175,"Twelve days later , I made my second .",Twelve days,It took twelve days to make another .,twelve days,I made my first one .,my first one
176,"The number of Arawak had already fallen dramatically , so the Spanish began to import slaves from Africa to work the land ; the first Africans arrived in 1517 .",the first Africans,Slaves had to be imported when the amount of Arawak began to decline .,the amount of Arawak,The Spanish had plenty of Arawak to use as slaves .,The Spanish
177,"Mrs . Vandemeyer , she read , "" 20 South Audley Mansions .",Mrs . Vandemeyer,""" 20 South Audley Mansions "" is a book that Mrs . Vandemeyer read .",""" 20 South Audley Mansions """,""" 11 Cottages in North Haversham , "" read Mrs . Vandemeyer .",11 Cottages in North Haversham
178,"Traditionally a poor island , the native population has happily embraced the new seasonal lifestyle that has brought them proserity , and the old ways have almost completely disappeared .",the old ways,The old ways of the native population has almost completely faded away .,The old ways of the native population,The island still holds on to its old ways as the natives have not embraced the new lifestyle .,The island
179,"For adventurous travelers looking for an introduction to the South , the rewards are rich .",the rewards,Rewards for adventurous travelers are rich .,Rewards for adventurous travelers,There ' s not much of interest for travelers looking for an adventurous introduction to the South .,much of interest for travelers looking for an adventurous introduction to the South
180,It covers most but not all close Senate and gubernatorial races . ),most but not all close Senate and gubernatorial races,Most close Senate races get covered .,Most close Senate races,It doesn ' t cover any Senate races .,any Senate races
181,The point is not that investing in foreign companies is necessarily a mistake .,The point,It is possible to put money into foreign companies .,foreign companies,It is not possible to invest into foreign businesses .,foreign businesses
182,"Currently OASI and DI make payments to that Account , and HI receives payment .",OASI and DI,Currently DI and OASI make payments into that account .,DI and OASI,"Currently , HI and OASI make payments to the account while DI receives payment .",HI and OASI
183,"In addition to the effects on household saving choices , individual accounts may also affect the relationship and interactions between Social Security and private pensions .",individual accounts,Social Security and private pensions would also be affected by individual accounts .,Social Security and private pensions,Social Security would not need to be adjusted in response to individual accounts .,Social Security
184,Washington Post reports two attempts by private companies to grow embryos - - a practice banned among federally funded researchers but allowed in the private sector .,Washington Post,Washington Post has reported on two attempts by private companies to grow embryos,Washington Post,Washington Post has never made a report on the subject of embryos .,Washington Post
185,a plausible increase in the penetration of computer ownership by households over the course of a single year .,a plausible increase,Computer ownership by households usually increases in a year .,Computer ownership by households,Households do not own any computers and that will never change .,any computers
186,"But the explanation is institutional , not ideological .",the explanation,The explanation isn ' t ideological .,The explanation,The explanation is ideological not institutional .,The explanation
187,You and Tuppence have been sticking together like Siamese twins .,You and Tuppence,You and Tuppence have been hand in glove .,You and Tuppence,You and Tuppence have barely seen each other .,You and Tuppence
188,"Below the Rond - Point , the mood changes and a pleasant park leads you past two the Petit Palais , all steel and glass , and the Grand Palais .",the mood changes and a pleasant park,"The mood changes below the Rond - Point , and a pleasant park leads you past two the Petit Palais , all steel and glass , and the Grand Palais .",The mood,"Below the Rond - Point , nothing changes , it ' s as if everything ' s pefect already .",the Rond
189,Participants generally agreed that improvements in corporate governance will bring about improvements in auditing .,improvements in corporate governance,There will be Improvements in auditing due to better corporate governance .,Improvements in auditing,Improved corporate governance would lead to worse auditing .,Improved corporate governance
190,Ever see a contemplative Power Ranger ?,a contemplative Power Ranger,Have you ever seen a Power Ranger sit and think ?,a Power Ranger,Ever see an impulsive Power Ranger .,an impulsive Power Ranger
191,"However , I believe that additional actions by the board and AICPA management will be needed to restore trust and confidence in the Institute over the longer - term .",additional actions by the board and AICPA management,Trust and confidence in the Institute have been temporarily lost .,Trust and confidence in the Institute,Trust and confidence in the Institute have been lost forever .,Trust and confidence in the Institute
192,"Every tube contained a body , and every body was a famous figure from history .",Every tube,Each tube held a famous person from history .,Each tube,The tubes held everyday people .,The tubes
193,"Four sikhara domes rise above the entrance - porch in addition the mandapa hall for worshippers ; a larger hall for dancing - girls ; and the inner sanctuary , surrounded by an ambulatory for walking around the image of the deity .",Four sikhara domes,"There is a mandapa hall , a hall for dancing , and an inner sanctuary , which is encircled by a walking path .","a mandapa hall , a hall for dancing , and an inner sanctuary , which is encircled by a walking path","Visitors are not permitted to walk around the image of the deity , but must sit quietly in front of it .",front of it
194,"The great Kanto earthquake of 1923 destroyed some 60 , 000 homes in Yokohama and took over 20 , 000 lives .",The great Kanto earthquake of 1923,"In 1923 , the great Kanto earthquake destroyed many homes and killed many people .",the great Kanto earthquake,The great Kanto earthquake caused little damage in Yokohama .,The great Kanto earthquake
195,"The only adult males allowed in the Harem were the Black Eunuchs , who were in charge of security and administration .",The only adult males allowed in the Harem,The Black Eunuchs were responsible for the security and administration of the Harem .,The Black Eunuchs,"The Black Eunuchs were not allowed in the Harem , only the slaves were .",The Black Eunuchs
196,"Due to the amount of information now available , power has shifted from the physician to the patient .",the amount of information now available,Patients have more power now because more information is available .,more power,Doctors have more power than ever thanks to better data availability .,more power
197,i know i am um i don ' t know anybody in their right mind that says that that i ' m doing it because i want to i,anybody in their right mind that says that that i ' m doing it because i want to i,I don ' t know anyone who ' s saying I ' m performing this because I desire to .,anyone who ' s saying I ' m performing this because I desire to,I know there are people who think I ' m doing it because I desire to .,people who think I ' m doing it because I desire to
198,"Isn ' t that America ' s last bastion of mobsters , racists , and hacks ?","America ' s last bastion of mobsters , racists , and hacks","Isn ' t is America ' s last wave of mobsters , racists and hacks ?","America ' s last wave of mobsters , racists and hacks",It ' s America ' s first wave of racists .,America ' s first wave of racists
199,"There is also an archaeological museum that displays older relics , including examples of Mycenaean pottery .","an archaeological museum that displays older relics , including examples of Mycenaean pottery",There are displays in the museum of old things .,displays in the museum of old things,The museum is completely empty and doesn ' t have anything in it .,The museum
200,There are nonetheless a number of practices and alternative strategies that senior executives in leading organizations use to help define and institute their CIO positions to effectively meet business needs .,a number of practices and alternative strategies that senior executives in leading organizations use to help define and institute their CIO positions to effectively meet business needs,There are however practices and strategies that can help CIO positions to meet business needs .,practices and strategies that can help CIO positions to meet business needs,There are no practices and strategies that can help CIO positions to meet business needs at the moment .,no practices and strategies that can help CIO positions to meet business needs at the moment
201,"By one estimate , Russia ' s economic output would more than double if the Russians simply sold off their natural resources instead of trying to make something out of them .",Russia ' s economic output,Russia ' s economic prosperity would double if Russians sold their natural resources instead of building up the manufacturing sector and trying to make products out of them .,Russia ' s economic prosperity,The Russians are not in a position to make money on the world market no matter what they do .,The Russians
202,Research over the last 20 years has changed the scientific view of life .,Research over the last 20 years,The scientific view of life is influenced by research .,The scientific view of life,"Research has no impact on how life is seen , scientifically .","no impact on how life is seen , scientifically"
203,yeah well uh we ' re not uh really sailors but i want some summer soon to um hire a sailboat with a captain since we ' re not you know versed in that and uh go to the Caribbean,some summer soon to um hire a sailboat with a captain since we ' re not you know versed in that and uh go to the Caribbean,In order to sail to the Caribbean he will have to hire sailors .,the Caribbean,They are confident in their sailing ability .,their sailing ability
204,In June you can watch dealers haggling over heaps of white silkworm cocoons .,heaps of white silkworm cocoons,During the summer months dealers barter for piles of silkworm cocoons .,the summer months,Silkworm cocoons were worthless and often just thrown away .,Silkworm cocoons
205,"The results looked like Versace melded with Blade Runner , says Newsweek ' s Steven Levy .",Newsweek ' s Steven Levy,Steven Levy compares the result to Versace and Blade Runner .,Steven Levy,Steven Levy has never seen Blade Runner .,Steven Levy
206,"The bourgeoisie showed off its new prosperity with extravagant furnishings , silks , satins , and baubles , and in 1852 Paris opened its first department store , Au Bon Marche .",The bourgeoisie,Paris opened the first department store .,the first department store,Paris opened a department store in 1994 .,a department store
207,He waited for the group on the nearby 18 th green to finish .,the group,He was patient while hte group on the 18 th hole finished .,hte group,He demanded the group on tthe 18 th hole finish immediately .,the group
208,i think so i don ' t know i just uh i ' m unhappy with it but and well i ' m i ' m sort of semi fortunate right now i ' m a graduate student so i don ' t make that much what i make isn ' t taxed very highly because i ' m still in school,a graduate student,I am a graduate student so my taxes aren ' t that high .,a graduate student,I have never been a college student .,a college student
209,"He thought about ways to achieve this life goal for a long time , which means until he learned the basics of text editing , which happened at his first job at a firm trading in plastic bags landfill disposal permits .","a long time , which means until he learned the basics of text editing , which happened at his first job at a firm trading in plastic bags landfill disposal permits",He thought about ways to achieve his life goals for a long time .,ways to achieve his life goals for a long time,He did not think about his life goals .,his life goals
210,"Kofukuji ' s many surviving artworks and artifacts are housed in its newest building , the Museum of National Treasures , a fireproof repository built in 1958 to honor Kofukuji ' s immense cultural and historic importance .",Kofukuji ' s many surviving artworks and artifacts,The fireproof repository built in 1958 is considered to be enough to protect the artifacts .,The fireproof repository built in 1958,Kofukuji ' s culture and history isn ' t considered to be too important .,Kofukuji ' s culture and history
211,no not near as much as i ' d like to i mean i ' ve i tend to stay pretty busy at my job and uh,my job,My job keeps me too busy for other things .,My job,My job doesn ' t get too busy .,My job
212,We have a problem concerning gift etiquette .,a problem concerning gift etiquette,"When it comes to gift etiquette , there is definitely a problem here .",gift etiquette,We don ' t have any issues here when it comes to gift etiquette .,any issues
213,The Inglethorps did not appear .,The Inglethorps,The Inglethorps did not show up .,The Inglethorps,The Inglethorps were the first ones to turn up .,The Inglethorps
214,equivalent to increasing national saving to 19 .,national saving,Increasing national saving to 19 its the equivalent of that .,its the equivalent of that,There is no equivalent to this .,no equivalent to this
215,"There ' s a sort of bidding war going on , with law schools offering ever - increasing financial packages - - most of it loans , said Dean Glen .",Dean Glen,"Dean Glen said that law schools are bidding for new talent , but most of this ends up loans .",Dean Glen,No one really cares about the new students coming to their institutions .,No one
216,"Today , as always , the time - honored occupations of fishing and farming support Martinique ' s fragile existence the delicious rum also helps .",the time,"Rum contributes to Martinique ' s prosperity , along with farming .",Martinique ' s prosperity,Fishing is not part of the economy of Martinique .,part of the economy of Martinique
